"The Cellular Uptake, Distribution and Toxicity of Poly (lactic-co-glycolic) Acid Nanoparticles in M. sativa Suspension Culture",""
"in the  future. This might be a safe alternative method for","Liriodendron hybrid suspension cells. Sci. China: Life"
"plant gene transfer.","Sci., 56: 82-89 (2013)."
"","12.  K. PASUPATHY, S. LIN, Q. HU, H. LUO, P.C. KE."
"Acknowledgements","Direct  plant  gene  delivery  with  a  poly  (amidoamine)"
"","dendrimer. Biotechnol. J., 3: 1078-1082 (2008)."
"This research has been supported by Yıldız Technical",""
"","13.  C. DONG, J. SHI, Y. LU, J. CHEN, B. XIA. Interaction"
"University  Scientific  Research  Projects  Coordination",""
"","characteristics of the co-incubation between CdSe/ZnS"
"Department, Project number: FDK-2018-3237.",""
"","quantum  dots  and  Liriodendron  hybrids  suspension"
"","cells  by  PEG-mediation.  Scientia  Sinica  Vitae,  41:"
"References",""
"","494-501 (2011)."
"1. 
P. SHARMA, S. BROWN, G. WALTER, S. SANTRA,","14.  J.  LIU,  F.-H.  WANG,  L.-L.  WANG,  S.-Y.  XIAO,"
"B.  MOUDGIL,  Nanoparticles  For  Bioimaging.  Adv.","C.-Y.  TONG,  D.-Y.  TANG,  X.-M.  LIU.  Preparation"
"Colloid Interface Sci., 123: 471-485 (2006).","of fluorescence starch-nanoparticle and its application"
"2.  H.  LU,  Y.  DAI,  L.  LV,  H.  ZHAO,  Chitosan-Graft-","as  plant 
transgenic  vehicle.  J.  Cent.  South  Univ."
"Polyethylenimine/DNA  Nanoparticles  as  Novel  Non-","Technol., 15: 768-773 (2008)."
"Viral Gene Delivery Vectors Targeting Osteoarthritis.","15.  A.R.  SANTOS,  A.S.  MIGUEL,  A.  MACOVEI,"
"PLoS One, 9(1): (2014).","C. MAYCOCK,  A. BALESTRAZZI,  A. OLIVA,"
"3. 
T. ARASOGLU, S. DERMAN, B. MANSUROGLU.","P.  FEVEREIRO.  CdSe/ZnS  Quantum  Dots  trigger"
"Comparative  evaluation  of  antibacterial  activity  of","DNA 
repair  and  antioxidant  enzyme  systems 
in"
"caffeic  acid  phenethyl  ester  and  PLGA  nanoparticle","Medicago  sativa  cells 
in  suspension  culture.  BMC"
"formulation  by  different  methods.  Nanotechnology,","Biotechnology, 13: 111 (2013)."
"27(2):025103 (2015).","16.  M.V.  VARMA,  A.M.  KAUSHAL,  A.  GARG,  S."
"4.  H.  ZARE,  G.  D.  NAJAFPOUR,  M.  JAHANSHAHI,","GARG.  Factors  affecting  mechanism  and  kinetics  of"
"M.  RAHIMNEJAD,  M.  REZVANI.  Highly  stable","drug  release  from  matrix  based  oral  controlled  drug"
"biosensor  based  on  glucose  oxidase 
immobilized","delivery  systems.  Am.  J.  Drug  Delivery  2:  43-57"
"in  chitosan  film  for  diagnosis  of  diabetes.  Rom.",""
"","(2004)."
"Biotechnol. Lett., 22:3 (2017).",""
"","17.  V.E.  SANTO,  A.R.C.  DUARTE,  M.E.  GOMES,"
"5. 
Z.  CIFUENTES,  L.  CUSTARDOY,  J.M.  DE  LA",""
"","J.F. MANO, R.L. REIS. Hybrid 3D structure of poly"
"FUENTE,  C.  MARQUINA,  M.R.  IBARRA,  D.",""
"","(d,  l-lactic  acid)  loaded  with  chitosan/chondroitin"
"RUBIALES, A. PÉREZ-DE-LUQUE. Absorption and",""
"","sulfate  nanoparticles  to  be  used  as  carriers  for  bio-"
"translocation  to  the  aerial  part  of  magnetic  carbon-",""
"","macromolecules  in 
tissue  engineering.  J.  Supercrit."
"coated  nanoparticles  through  the  root  of  different",""
"","Fluids, 54: 320-327 (2010)."
"crop plants. J. Nanobiotechnol. 8: 26 (2010).",""
"","18.  L.  CHRONOPOULOU,  A.  CUTONILLI,  C.  CAMETTI,"
"6. 
Z.U. REHMAN, I.S. ZUHORN, D. HOEKSTRA. How",""
"","M.  DENTINI,  C.  PALOCCI.  PLGA-based  nanopar-"
"cationic 
lipids 
transfer  nucleic  acids 
into  cell  sand",""
"","ticles: effect of chitosan in the aggregate stabilization."
"across cellular membranes: recent advances. J. Controlled",""
"","A  dielectric  relaxation  spectroscopy  study.  Colloids"
"Release, 166: 46-56 (2013).",""
"","Surf., B., 97: 117-123 (2012)."
"7. 
P. WANG, E. LOMBI, F.-J. ZHAO, P.M. KOPITTKE.",""
"","19.  S.  VIDAWATI,  S.  BARBOSA,  P.  TABOADA,  E."
"Nanotechnology: a new opportunity in plant sciences.",""
"","VILLAR,  A.  TOPETE,  V.  MOSQUERA.  Study  of"
"Trends Plant Sci., 21: 699-712 (2016).",""
"","Human  Serum  Albumin-SPIONs  Loaded  PLGA"
"8.  A. VALLETTA, L. CHRONOPOULOU, C. PALOCCI,",""
"","Nanoparticles for Protein Delivery. Adv. Biol. Chem.,"
"B. BALDAN, L. DONATI, G. PASQUA. Poly (lactic-",""
"","8: 91-100 (2018)."
"co-glycolic) acid nanoparticles uptake by Vitis vinifera",""
"","20.  D.  LIN,  B.  XING.  Root  uptake  and  phytotoxicity  of"
"and grapevine-pathogenic fungi. J. Nanopart. Res., 16:",""
"","ZnO  nanoparticles.  Environ.  Sci.  Technol.  42:5580-"
"2744 (2014).",""
"","5585 (2008)."
"9.  A.T. SILVA, A. NGUYEN, C. YE, J. VERCHOT, J.H.",""
"","21.  S.  LIN,  J.  REPPERT,  Q.  HU,  J.S.HUDSON,  M.L"
"MOON.  Conjugated  polymer  nanoparticles  for  effec-",""
"","REID,  T.A.RATNIKOVA,  A.M.RAO,  H.  LUO,  P.C."
"tive siRNA delivery to tobacco BY-2 protoplasts. BMC",""
"","KE.  Uptake  translocation  and  transmission  of  carbon"
"Plant Biol., 10: 291 (2010).",""
"","nanomaterials in rice. Small, 5: 1128-1132 (2009)."
"10.  M.F.  SERAG,  N.  KAJI,  C.  GAILLARD,  Y.",""
"","22.  E.  WILD,  K.C.  JONES.  Novel  method  for  the  direct"
"OKAMOTO,  K.  TERASAKA,  M.  JABASINI,  M.",""
"","visualization  of  in  vivo  nanomaterials  and  chemical"
"TOKESHI, H. MIZUKAMI, A. BIANCO, Y. BABA.",""
"Trafficking and subcellular localization of multiwalled","interactions in plants. Environ. Sci. Technol., 43: 5290-"
"carbon nanotubes in plant cells. ACS nano, 5: 493-499","5294 (2009)."
"(2010).","23.  A. HISCHEMŌLLER, J. NORDMANN, P. PTACEK,"
"11.  B.  XIA,  C.  DONG,  W.  ZHANG,  Y.  LU,  J.  CHEN,","K. MUMMENHOFF, M. HAASE. In-vivo imaging of"
"J.  SHI.  Highly  efficient  uptake  of  ultrafine  mesoporous","the  uptake  of  up  conversion  nanoparticles  by  plant"
"silica nanoparticles with excellent biocompatibility by","roots. J. Biomed. Nanotechnol., 5:278-284 (2009)."
