"Pharmaceuticals 2025, 18, x FOR PEER REVIEW","8  of  30","7 of 28"
"","Figure 4. (a) SEM image of hydrogel, (b) transform infrared spectroscopy, (c) differential scanning",""
"","calorimeter, and (d) hesperidin release profile from double nanoemulsion at pH 5.4 and 7.4.",""
"","Figure 4. (a) SEM image of hydrogel, (b) transform infrared spectroscopy, (c) diﬀerential scanning",""
"","calorimeter, and (d) hesperidin release proﬁle from double nanoemulsion at pH 5.4 and 7.4.",""
"","In this study, the FTIR spectra demonstrate molecular interactions and HSP’s success-",""
"","ful integration into the hydrogel. The FTIR spectra show molecular interactions and the",""
"","successful incorporation of HSP into hydrogel and double emulsion systems. Neem oil has",""
