"Pharmaceutics 2022, 14, x FOR PEER REVIEW 
21  of  30"
"fusion release mechanism was directed [97,99]. The non-linear curve fitting of in vitro re-"
"lease  data  obtained  for  PLGA-NPs-5,  using  the  Higuchi  matrix  model  (primarily)  and"
"Korsmeyer–Peppas model (secondary), shows that the release constant (k, indicating the"
"rate of drug release) was directly proportional to the diffusion exponent. Therefore, the"
"drug release was depended on the structural and physical properties of the IND and the"
"PLGA-matrix. The highest values of “k” (kHP, 2.08 × 10−1 and kHM, 5.26 × 10−2 h−1) were found"
"Pharmaceutics 2022, 14, 870
20 of 29"
"with PLGA-NPs-5 (Table 3). These findings were in agreement with the previous reports"
"for  the  release  of  vancomycin  from  chitosan-alginate  microparticles  [100]  and from  the"
"microporous calcium phosphate ceramics [101]."
"Korsmeyer–Peppas model (secondary), shows that the release constant (k, indicating the"
"rate of drug release) was directly proportional to the diffusion exponent. Therefore, the"
"3.7. DSC Analysis"
"drug release was depended on the structural and physical properties of the IND and the"
"PLGA-matrix. The highest values of “k” (kHP, 2.08 × 10−1 and kHM, 5.26 × 10−2 h−1) were"
"(PLGA-NPs-5) to determine any possible complexation of the polymer (PLGA) with the"
"found with PLGA-NPs-5 (Table 3). These ﬁndings were in agreement with the previous"
"stabilizers (PVA and PVP), and to check the crystallinity of the encapsulated model drug"
"reports for the release of vancomycin from chitosan-alginate microparticles [100] and from"
"(IND). The overlay scans of DSC were represented in Figure 10. A sharp endothermic peak"
"the microporous calcium phosphate ceramics [101]."
"at 157 °C for IND was appeared as shown in Figure 10A, indicates the crystalline charac-"
"teristic of the drug. The reported melting point of indomethacin is 158 °C, a slight variation"
"in the melting temperature indicated the purity of the drug. The endothermic peaks of"
"Differential Scanning Calorimetry was conducted on the optimized lyophilized NPs"
"PLGA (Figure 10B), PVA (Figure 10C) and PVP (Figure 10D) appeared at 60 °C, 202 °C"
"(PLGA-NPs-5) to determine any possible complexation of the polymer (PLGA) with the"
"and 152 °C respectively. The peak of IND was almost diminished in the PLGA-NPs sug-"
"stabilizers (PVA and PVP), and to check the crystallinity of the encapsulated model drug"
"gesting that the drug was encapsulated into the core of the NPs. The appearance of a very"
"(IND). The overlay scans of DSC were represented in Figure 10. A sharp endothermic"
""
"low intensity melting peak (at around 158 °C) in case of PLGA-NPs-5 (Figure 10E), might 
peak at 157 ◦C for IND was appeared as shown in Figure 10A,
indicates the crystalline"
"characteristic of the drug. The reported melting point of indomethacin is 158 ◦C, a slight"
"variation in the melting temperature indicated the purity of the drug. The endothermic"
"ophilized PLGA-NPs, indicating that the stabilizer was completely washed out during the 
peaks of PLGA (Figure 10B), PVA (Figure 10C) and PVP (Figure 10D) appeared at 60 ◦C,"
"purification steps by ultracentrifugation or the traces of the stabilizer (if remained), was 
202 ◦C and 152 ◦C respectively. The peak of IND was almost diminished in the PLGA-NPs"
"not in the crystalline state. Furthermore, non-appearance of any new peaks throughout"
"the scanning of the NPs, indicating the good compatibility among all the excipients used 
very low intensity melting peak (at around 158 ◦C) in case of PLGA-NPs-5 (Figure 10E),"
"might be due to the presence of surface adsorbed drug in the crystalline state."
