"B","CS:PLGA weight ratio","0","0.4:1","0.8:1","0.60",""
"C","Sonication time (min)","4","8","12","12",""
"","","Transmission  electron  microscopy (TEM)  analysis was  employed  to  determine  the","","","",""
"","","particles’ shape and average size. As illustrated in Figure 2A, the NPs displayed a spher-","","","",""
"","","ical shape, with some being agglomerated, which agreed with previous reports on CS and","","","",""
"","","PLGA polymeric NPs [5,38]. The mean average size of the optimal H/CS/PLGA NPs for-","","","",""
"","","mulation was determined by employing the image processing program Image J (NIH, Be-","","","",""
"Nanomaterials 2021, 11, 2438","","","","","","6 of 16"
"","","thesda,  MD, USA) and  was found  to  be  194 ±  47  (Figure 2B),  which  is  close  to  the  one","","","",""
"","","obtained from the Zetasizer (202.27 ± 2.44 nm).","","","",""
