"and  silica-based30,31  nanoparticles,  quantum  dots32)  have  been  developed  to:  (i)  improve  the  solubility  and  stability  of"
"insoluble  drugs;  (ii)  prevent  nonspecific  distribution  and  degradation  in  vivo,  and  (iii)  increase  drug  concentration  in"
"tumor  lesions  through  the  effect  of  enhanced  permeation  and  retention  (EPR).33,34  Most  drug  delivery  systems  thus"
"reduce  the  therapeutic  dose  by  passively  delivering  the  drug  into  tumor  tissue.  Similarly,  through  a  sustained  and"
"controlled drug delivery, nanoparticles provide more effective tumor cell killing than drug alone."
"Among  the various polymer-based nanoparticles, those based on poly(lactic-co-glycolic acid) (PLGA) are the most"
"safe and versatile for drug delivery applications. PLGA is a Food and Drug Administration (FDA)-approved biodegrad-"
"able  polymer  widely  used  in  cancer  nanotechnology.  It  is  also  suitable  for  encapsulation  of  lipophilic  drugs  due  to  its"
"hydrophobicity.35  In  addition,  the  range  of  applications  and  the  drug  loading  capacity  of  PLGA  can  be  expanded  by"
"optimizing its structure.36"
"Since  2007,  according  to  EASL  HCC  guidelines,37  SOR  is  recommended  as  the  gold  standard  first-line  systemic"
"therapy for patients with advanced HCC or who fail to respond to loco regional therapies.38–40 SOR is the only systemic"
"therapy  proven  to  extend  overall  survival  when  used  as  a  first-line  treatment,  showing  a  gradual  median  improvement"
"over time (from 10.7 months in the SHARP study (2005–2006),38  to 12.3 months in the REFLECT study (2015)41  and"
"over 13 months in the IMbrave-150 study (2018–2019)).42"
"SOR  is  a  dual  aryl  multi-kinase  inhibitor  that  inhibits  tumor  cell  proliferation  blocking  the  cell  signaling  pathway"
"mediated by Raf/MEK/ERK.43 It also indirectly inhibits tumor cell growth interfering with the tyrosine kinase activity of"
"vascular  endothelial  growth  factor  receptors,  of  serine-threonine  kinases  Raf-1,  B-Raf44,45  and  platelet-derived  growth"
"factor  receptor  β  (PDGFR-β).46,47  Administration  of  SOR  is  the  most  effective  single-drug  therapy  and  along  with"
"levantinib,  among  the  few  systemic  treatments48  capable  of  prolonging  overall  patient  survival  and  reducing  tumor"
"progression in HCC patients. However, its severe side effects49  including hand-foot skin reaction, decreased heart blood"
"flow, heart attack, intestinal perforation, alteration of thyroid hormone levels, loss of appetite, diarrhoea, rash, often lead"
"to treatment discontinuation. Furthermore, SOR is poorly water soluble and is rapidly cleared and metabolized, resulting"
"in low absorption efficiency in tumor tissue50  which severely limit its use for local treatments.51  The high toxicity and"
"low bioavailability of SOR thus result in a narrow therapeutic window."
"All these drawbacks may be overcome using nanocarriers like PLGA nanoparticles and targeted nanocomposites52,53"
"able  to  selectively  deliver  the  drug  to  target  tissues.54,55  Previous  studies  reported  rather  low  SOR  loading  (1.4%)  in"
"PLGA nanoparticles using oil-in-water single emulsion solvent evaporation methods.56 Multiblock polymer nanoparticles"
