"Fig. 8. Fluorescence images of HEK TRPV1 cells, pre-incubated with Fluo-4, captured 30 min after the addition of: (A) buffer, (B) blank NPs, (C) ionomycin, (D) CPh"
"NPs, (E) MC NPs, (F) NL NPs, (G) CBGA NPs, (H) CBGA NPs/CPh NPs, (I) CBGA NPs/MC NPs, and (J) CBGA NPs/NL NPs. The concentrations of CBGA- and terpene-"
"loaded NPs in both individual and combination formulations were set at the EC50 for each respective nanoparticle. The images shown are representative of three"
"independent experiments. Scale bar: 50 μm. (K) corresponding Relative fluorescence intensity (RFI) of cell images, and (L) comparisons of calculated and experi-"
"mental RFI values corresponding to combinations of CBGA NPs and terpene NPs. The experiment was conducted in triplicate (n = 3). RFI values are presented as"
"mean ± SD, respectively. Statistically significant differences are indicated as follows: * for combination formula vs. CBGA NPs (p < 0.05); † for combination formula"
"vs. respective terpene NPs (p < 0.05); # for experimental combination formula vs. calculated combination formula (p < 0.05)."
