"Fig. 7. Fluorescence changes measured using a calcium signaling assay. HEK TRPV1 cells (15 × 104 cells/well; 180 μL) were pre-treated with 1 μM Fluo-4 AM and"
"suspended in 1 mM Ca Assay Buffer before the addition of stimulants (CBGA NPs, terpene-loaded NPs, or their combination) at a final concentration corresponding to"
"the EC50 for each type of nanoparticle. Ionomycin (4 μM) was used as a positive control. Fluorescence was monitored over 1 h, with readings taken every 40 s at an"
"excitation/emission wavelength of 485/528 nm. (A) Calcium response plots; (B) corresponding AUCs, and (C) comparisons of calculated and experimental AUC"
"values corresponding to combinations of CBGA NPs and terpene NPs. The experiment was conducted in triplicate (n = 3). Calcium responses and AUC results are"
"presented as mean values and mean ± SD, respectively. Statistically significant differences are indicated as follows: * for combination formula vs. CBGA NPs (p <"
