"chondrosarcoma cell line T-CDS17#4; (C) or a culture of non-transformed hBM-MSCs (D) with increasing concentrations"
"of MTM for 72 h. The effect of equivalent amounts of empty nanoparticles are shown. IC50 values for each treatment are"
"indicated. Error bars represent the standard deviation of three independent experiments."
"3.3. Nano-Encapsulated MTM Targets Cancer Stem Cells (CSCs) Subpopulations in Sarcoma."
"Cancer stem cell (CSC) subpopulations are thought to be responsible for tumor main-"
"tenance, being directly associated with invasion and metastatic dissemination [45]. Rele-"
"vantly, MTM has demonstrated its potential to eliminate CSC subpopulations in different"
"types of cancer [12,14,15,17]. CSC-enriched cell culture can be obtained by growing cells"
"as ﬂoating 3D tumorspheres [34]. Therefore, we tested the ability of the different MTM"
"formulations to target CSCs by analyzing their anti-proliferative effect in tumorsphere"
"cultures."
"Using this 3D model, we ﬁnd that both free MTM and all assayed MTM nano-delivery"
"systems are equally able to decrease the number and the size of T-5H-FC#1 tumorspheres"
"(Figure 3A,B). Furthermore, empty nanoparticles do not induce any cytotoxic effect against"
"CSC-enriched cultures (Figure 3C)."
