"Tapscott SJ, Storb R: Sustained AAV-mediated dystrophin expression in a"
"canine model of Duchenne muscular dystrophy with a brief course of"
"immunosuppression. Mol Ther 2007, 15(6):1160–1166. Epub 2007 Apr 10."
"doi:10.1186/1479-5876-12-171"
"Cite this article as: Fargnoli et al.: Anti-inflammatory loaded poly-lactic"
"glycolic acid nanoparticle formulations to enhance myocardial gene"
"transfer: an in-vitro assessment of a drug/gene combination therapeutic"
"approach for direct injection. Journal of Translational Medicine"
"2014 12:171."
