"mg/ml, X3 = 10.10%). Table 5 represents the predicted values and experimental results for the"
"four response variables at the optimal levels of the three factors. The errors between the"
"observed (measured) and predicted values of the four responses were less than 5%, showing"
"the good predictability and reliability of the constructed models [34]."
"Morphology, particle size and drug loading"
"The surface morphology of microspheres prepared with the optimized formulation was"
"observed by SEM. The prepared microspheres were spherical and smooth without any pores"
"on their surface (Fig 8). Moreover, the microspheres appear to be regular and homogeneous."
"Particle size is an important feature of microspheres, as it can influence the drug content,"
"drug EE, drug release rate, and initial burst release of microspheres [32]. As shown in Fig 9,"
"the mean diameter of the microspheres was approximately 40 μm, with an average value of"
"42.36 ± 1.33 μm. The particle size of the microspheres is uniform with a small span of size dis-"
"tribution (1.03 ± 0.05). These results are consistent with the above SEM results."
"After the drug content assay, the drug content and EE of the prepared microspheres were"
"calculated as 7.96 ± 0.19% and 80.16 ± 3.36, respectively."
"The preparation method used in this work is emulsion solvent evaporation, which was"
"adopted with some modifications reported by Wu et al. [11]. Since this technique requires no"
"special equipment [35] and only mild conditions such as constant stirring and ambient tem-"
"perature [36], it is widely applied in the preparation of microspheres and is superior to other"
"methods."
