"Figure 2 shows that, compared with the raw material drug, the release of lidocaine microspheres had"
"a  significant  slow-release  effect  in  the  plasma.  The raw  material  drug  released  completely  at  around"
"1  h  (93%),  while  the  release  of  microspheres  only  reached  51%  within  20  h.  In  the  following  4  h,"
"the  microspheres  entered  the  slow  release  period  and  released  up  to  about  61%  at  the  end  of  the"
"observation (40 h). During the release process, the release of microspheres showed two distinct phases: rapid"
"release during the first 4 h, with basically no sudden release phenomenon; and then, this was stabilized."
"The cumulative release of drug from the microspheres was fit by a single exponential function, Weibull"
"function and Higuchi model. The correlation coefficient for each equation was used as the index. It was found"
"that in vitro release of lidocaine microspheres was more in line with the Higuchi model, which proved"
"that microsphere with PLGA as a carrier had better sustained release. The large ratio of surface area"
"and volume of lidocaine, as well as surfactant promoted rapid drug release, with a later slow continuous"
"drug  release  with  the  gradual  dissolution  of  the  PLGA  skeleton  of  microspheres.  Part  of  the  drug"
