"Int. J. Mol. Sci. 2014, 15","17472"
"","The  plasma  concentration-time  profiles  of  lidocaine  after  intravenous  administration  by  injection"
"and microspheres to rats are shown in Figure 3, and the pharmacokinetic parameters are summarized",""
"in Table 1. The area under the curve of lidocaine in microspheres was 2.02–2.06-fold that of lidocaine",""
"injection  (p  <  0.05).  The  maximum  plasma  concentration  of  lidocaine  injection  was  1.58-fold  that",""
"of  lidocaine  microspheres  (p  <  0.05).  The  relatively  slower  time  to  maximum  plasma  concentration",""
"of lidocaine microspheres suggested a sustained-release profile in vivo, which was consistent with the results",""
"of the in vitro release study.",""
