"Received 6 June 2013; accepted 22 October 2013; published online 13 November 2013"
"Abstract. This
investigation aimed to develop nimesulide (NMS)-loaded poly(lactic-co-glycolic acid)"
"(PLGA)-based nanoparticulate formulations as a biodegradable polymeric drug carrier to treat rheuma-"
"toid arthritis. Polymeric nanoparticles
(NPs) were prepared with two different nonionic
surfactants,"
"vitamin E d-α-tocopheryl polyethylene glycol 1000 succinate (vitamin E TPGS) and poly(vinyl alcohol)"
"(PVA), using an ultrasonication solvent evaporation technique. Nine batches were formulated for each"
"surfactant using a 32 factorial design for optimal concentration of the emulsifying agents, 0.03–0.09% for"
"vitamin E TPGS and 2–4% for PVA. The surfactant percentage and the drug/polymer ratio (1:10, 1:15,"
"1:20) of the NMS-loaded NPs were investigated based on four responses: encapsulation efficiency, particle"
"size,
the polydispersity index, and the surface charge. The response surface plots and linearity curves"
"indicated a relationship between the experiment’s responses and a set of independent variables. The NPs"
"produced with both surfactants exhibited a negative surface charge, and scanning electron micrographs"
"revealed that all of the NPs were spherical in shape. A narrower size distribution and higher drug loadings"
"were achieved in PVA-emulsified PLGA NPs than in the vitamin E TPGS emulsified. Decreasing amounts"
"of both nonionic surfactants resulted in a reduction in the emulsion’s viscosity, which led to a decrease in"
"the particle size of NPs. According to the ANOVA results obtained in this present research, vitamin E"
"TPGS exhibited the best correlation between the independent variables, namely drug/polymer ratio and"
"the surfactant percentage, and the dependent variables (encapsulation efficiency R2=0.9603, particle size"
"R2=0.9965, size distribution R2=0.9899, and surface charge R2=0.8969) compared with PVA."
