"clear, therefore, we would do more research about the cell uptake mechanism, e.g., Transport through cell mon-"
"olayers study."
"The mechanism of action of exenatide is capable of stimulating β-cells to release insulin under hyperglycemic"
"conditions, whereas without stimulation of insulin secretion, the glucose concentration is in the normal range35."
"Therefore, exenatide cannot promote severe hypoglycemic events18,36. The efficacy of the PEG-PLGA NPs and the"
"Fc-modified NPs following oral administration was investigated in db/db mice. The hypoglycemic effect study"
"demonstrated that all the oral NPs had a better hypoglycemic response compared to the oral exenatide solution."
"The FcRn-targeting NPs also reduced the glucose level more significantly than the unmodified NPs. In addition,"
"the hypoglycemic response of the FcRn-targeting NPs lasted for 12 h, which was longer than in the exenatide"
"s.c. administration group (8 h). It is noteworthy that the FcRn-targeting NPs maintained a lower glucose level"
"that was relatively steady compared with the exenatide s.c. administration. After 24 h, the glucose level remained"
"lower than that before dosing of the targeting NPs, which was similar with previous report and might be due to a"
"hypoglycemic agent15."
"Figure 6 shows the whole-body fluorescence in vivo image and demonstrates that the Fc-modified NPs were"
"retained in the gastrointestinal tract for a longer time (24 h) than the unmodified NPs (10 h). Moreover, as shown in"
"Fig. 7, the dissected major organs image showed that more fluorescence remained in the gastrointestinal tract and"
"remained longer for the Fc-modified NPs group compared with the unmodified NPs group. In addition, NPs in the"
"modified group entered the lung and kidney portions. All these phenomena demonstrated that the Fc-modified"
"NPs exhibited better gastrointestinal targeting attributes and benefitted the drug absorption in vivo. Furthermore,"
"it was reported previously that rodents could remarkably down-regulate FcRn expression in the intestine after"
"weaning18, while humans continue to express FcRn into adulthood. According to this theory, the transport of"
"Fc-modified NPs in humans could potentially be even more efficient in comparison with transepithelial transport"
"in mice. Therefore, the Fc-targeting drug delivery system is promising for orally delivered treatments in humans."
"Overall, the in vivo hypoglycemic effect and in vivo imaging results were in accordance with the in vitro cellu-"
"lar level studies. Fc-modified NPs are promising for peptide or protein oral delivery. However, much additional"
"research is needed to demonstrate the oral absorption of exenatide, e.g., pharmacokinetic study or the mechanism"
"of transport through Caco-2 cell research."
