"adjusted correlation coefficient (Rsqr_adj or R2 adjusted), the Akaike Information Criterion (AIC), and the Model"
"Selection Criterion (MSC). To assess different models, the highest R2, R2 adjusted, and MSC values, along with the"
"lowest AIC values, were used as benchmarks for selecting the best-fitting model44–46."
"Solid-state characterization"
"Thermal analysis"
"Thermal  properties  were  analyzed  using  a  differential  scanning  calorimeter  (DSC-60,  Shimadzu  Scientific"
"Instruments,  Columbia,  MI).  Approximately  5  mg  of  each  sample  was  placed  in  an  aluminum  crucible  and"
"subjected to a temperature range of 30–300 °C, with a heating rate of 10 °C/min and an air flow of 50 mL min− 1."
"Alongside the I-DNP sample, reference samples including pure DNP, I-Blank, and a physical mixture were also"
"tested for comparison47,48."
"Fourier-transform infrared spectroscopy (FT-IR) analysis"
"FT-IR spectra were recorded using a Shimadzu IR Prestige-21 (Shimadzu Corporation, Kyoto, Japan) over the"
"wavelength range of 4000–500 cm–1. The analysis included PLGA, DNP, the physical mixture, and the blank"
"formulation, which served as reference samples49."
"Nuclear magnetic resonance 1H-NMR) analysis"
"1H-NMR  analysis  was  performed  using  an  Ultra  Shield  CPMAS  NMR  spectrometer  (Brucker,  Rheinstetten,"
"Germany).  Samples  were  prepared  by  dissolving  formulations  in  deuterated  chloroform.  Reference  analyses"
"were also conducted on the blank formulation, physical mixture, DNP, and PLGA50,51."
"Biological activity studies"
"In vitro ache and BuChE inhibitor activity assay"
"The  acetylcholinesterase  (AChE)  and  butyrylcholinesterase  (BuChE)  enzyme  inhibition  activities  of  I-DNP"
"and  I-Blank  were  evaluated  using  a  modified  Ellman  Test  to  enhance  colorimetric  detection.  The  test  was"
"conducted with key materials such as BuChE (from horse serum), AChE (from electric eel), Ellman reagent,"
"buffer  solutions  (potassium  dihydrogen  phosphate  and  potassium  hydroxide),  5,5′-dithiobis  (2-nitrobenzoic"
"acid) (DTNB), sodium bicarbonate, acetylthiocholine iodide (ATC), butyryl thiocholine iodide (BTC), gelatin,"
"dimethyl sulfoxide (DMSO), and DNP. Measurements were performed at 412 nm using a BioTek-Synergy H1"
"Microplate Reader on 96-well plates. Enzyme solutions (2.5 µg mL− 1), substrate solutions (0.075 M ATC and"
"BTC), DTNB solution (0.01 M), and phosphate buffer (pH 8.0, 0.1 M) were prepared alongside test solutions"
"containing DNP concentrations of 100, 200, and 400 µg mL− 1."
"The  assay  involved  two  test  solutions:  the  first  contained  phosphate  buffer,  DTNB,  and  enzyme  solution"
"(AChE or BuChE), while the second included  phosphate  buffer  and  substrate (ATC or BTC). Each well was"
"loaded with 20 µL of the test solution and 110 µL of the first solution, mixed for 5 min, and incubated at 25 °C"
"for  15  min.  Following  incubation,  80  µL  of  the  second  solution  was  added,  mixed  for  30  s,  and  the  initial"
"absorbance measurement was taken at 412 nm. The reaction was allowed to proceed for 5 min, and a second"
"spectrophotometric measurement was performed33. The absorbance differences were calculated to determine"
"the percentage inhibition rates (Eq. 2). The abbreviations used in the formula are as follows: B: Blank (the well"
"where the test solution and substrate were not added), C: Control (the well where only the test solution was not"
"added), A(B): Absorbance difference of the blank well, A(C): Absorbance difference of the control well, A(I):"
"Absorbance difference of the test solution well."
