"with 95% relative humidity and 5% CO2. After proliferation for 4 days, cells were harvested using trypsin (0.25%)"
"containing ethylenediamine tetra-acetic acid (EDTA, 0.02%). For the cellular uptake study, Caco-2 cells were"
"seeded into 96-well or 6-well plates."
"Intracellular uptake studies. 
Caco-2 cells were quantitatively and qualitatively studied using flow cytom-"
"etry (FACS) and confocal laser scanning microscopy (CLSM), respectively."
"Confocal laser scanning microscope. 
To investigate the cellular interaction with NPs, the fluorescent"
"probe coumarin-6 was encapsulated to PEG-PLGA NPs and Fc-PEG-PLGA NPs. The cellular uptake of NPs was"
"detected by CLSM (FluoView FV1000, Olympus, Japan). Caco-2 cells were seeded into 24-well plates at a den-"
"sity of 1 × 105 cells/mL. The NPs were co-incubated with the cells for 0.5, 1, 2, 3, and 4 h at a dose of 200 ng/mL"
"(coumarin-6). The excitation wavelength was 466 nm, and the emission wavelength was 504 nm26."
"Flow cytometry. 
For flow cytometry, Caco-2 cells were seeded in 24-well cell culture plates at a density"
"of 5 × 105 cells per well and allowed to adhere for 48 h until confluency. Then, fluorescence microscopy was"
"performed to observe the cellular uptake. Coumarin-6-loaded PEG-PLGA NPs and coumarin-6-loaded"
"Fc-conjugated PEG-PLGA NPs (coumarin-6 concentrations: 6, 8, 10, 12, and 14 ng•mL−1) were co-incubated"
"with the cells for 90 min, and then, the cells were washed three times with PBS and detached from the plates by"
"trypsinization. The cells were then centrifuged at 1,500 rpm for 5 min (Sorvall Biofuge Primo R; Thermo Fisher"
"Scientific, Waltham, MA, USA). Afterwards, the supernatant was discarded, and the cells were resuspended in"
"PBS. Fluorescence was measured using a BD FACSAriaTM flow cytometer37."
"Hypoglycemic effect studies. 
In this study, db/db mice were used as a model of type II diabetes. All exper-"
"iments were performed according to the Institutional Animal Care and National Institutes of Health Guidelines"
"for the Care and Use of Laboratory Animals (USA), and the protocol was approved by the Committee on the"
"Ethics of Animal Experiments of Binzhou Medical University (Permit No. SCXK20140005). Glucose concentra-"
"tions were measured using a glucose meter (ACCU-CHEK® Integra, Germany)."
"Diabetic mice, eight per group, were treated with the following: oral administration of exenatide-loaded"
"PEG-PLGA NPs (100.0 μg/kg exenatide), exenatide-loaded Fc-PEG-PLGA NPs (100.0 μg/kg exenatide),"
"exenatide solution (100 μg/kg exenatide) or a s.c. injection of exenatide solution (10 μg/kg). Saline was injected"
"(s.c.) to a control group. Blood samples were collected from the tail veins at different time intervals (0, 1, 2, 3, 4, 6,"
"8, 10, 12 and 24 h), and the blood glucose concentration was measured with a glucose meter."
"In vivo imaging study. 
Dir, a hydrophobic fluorescence label, was encapsulated into PEG-PLGA NPs and"
"Fc-PEG-PLGA NPs. The NPs were administered orally to mice at a Dir dose of 0.25 mg/kg to investigate the Fc"
"targeting effects using in vivo imaging in live mice. Living mice were monitored at 0.5, 1, 2, 4, 6, 8, 10, 12 and"
"24 h after administration and organ images were obtained at the 2, 6, 12, and 24 h time points using the In-Vivo"
"Imaging System FX Pro (Carestream, NY, USA) with an excitation wavelength of 720 nm and an emission wave-"
"length of 790 nm. The images were analyzed using Carestream Image Suite Software38."
"Data availability. 
No datasets were generated or analyzed during the current study"
"References"
"1.  Tibble, C. A., Cavaiola, T. S. & Henry, R. R. Longer Acting GLP-1 Receptor Agonists and the Potential for Improved Cardiovascular"
"Outcomes. Expert Rev. Endocrinol. Metab. 8, 247–259 (2013)."
"2.  Gupta, V. et al. Delivery of Exenatide and Insulin Using Mucoadhesive Intestinal Devices. Annals of biomedical engineering 44,"
"1993–2007, https://doi.org/10.1007/s10439-016-1558-x (2016)."
"3.  Tomlinson, B., Hu, M., Zhang, Y., Chan, P. & Liu, Z. M. Investigational glucagon-like peptide-1 agonists for the treatment of obesity."
"Expert Opin Investig Drugs, 1–13, https://doi.org/10.1080/13543784.2016.1221925 (2016)."
"4.  Henry, R. R. et al. Continuous subcutaneous delivery of exenatide via ITCA 650 leads to sustained glycemic control and weight loss"
"for 48 weeks in metformin-treated subjects with type 2 diabetes. J Diabetes Complications 28, 393–398 (2014)."
"5.  Shrestha, N. et al. Oral hypoglycaemic effect of GLP-1 and DPP4 inhibitor based nanocomposites in a diabetic animal model. J"
"Control Release 232, 113–119 (2016)."
"6.  Thwala, L. N., Preat, V. & Csaba, N. S. Emerging delivery platforms for mucosal administration of biopharmaceuticals: a critical"
"update on nasal, pulmonary and oral routes. Expert Opin Drug Deliv, 1–14, https://doi.org/10.1080/17425247.2016.1206074 (2016)."
"7.  Zhang, Z. S. H. & Chen, L. et al. Synthesis of pH-responsive starch nanoparticles grafted poly(l-glutamic acid) for insulin controlled"
"release. Eur Polym J 49, 2082–2091 (2013)."
"8.  Cui, M. et al. Liposomes containing cholesterol analogues of botanical origin as drug delivery systems to enhance the oral absorption"
"of insulin. Int J Pharm 489, 277–284 (2015)."
"9.  Avgoustakis, K. Pegylated poly(lactide) and poly(lactide-co-glycolide) nanoparticles: preparation, properties and possible"
"applications in drug delivery. Curr Drug Deliv 1, 321–333 (2004)."
"10.  Jain, A. K. et al. PEG-PLA-PEG block copolymeric nanoparticles for oral immunization against hepatitis B. Int J Pharm 387,"
"253–262 (2010)."
"11.  Yun, Y., Cho, Y. W. & Park, K. Nanoparticles for oral delivery: targeted nanoparticles with peptidic ligands for oral protein delivery."
"Adv Drug Deliv Rev 65, 822–832 (2013)."
"12.  Sheng, J. et al. Enhancing insulin oral absorption by using mucoadhesive nanoparticles loaded with LMWP-linked insulin"
"conjugates. J Control Release 233, 181–190 (2016)."
"13.  Xu, Y. et al. The transport mechanism of integrin alphavbeta3 receptor targeting nanoparticles in Caco-2 cells. Int J Pharm 500,"
"42–53 (2016)."
"14.  Shan, W. et al. Overcoming the diffusion barrier of mucus and absorption barrier of epithelium by self-assembled nanoparticles for"
"oral delivery of insulin. ACS Nano 9, 2345–2356 (2015)."
"15.  Jin, Y. et al. Goblet cell-targeting nanoparticles for oral insulin delivery and the influence of mucus on insulin transport. Biomaterials"
"33, 1573–1582 (2012)."
