"Yi Zhang1,2, Yue Liu1, Hewei Shao1 and Xiaoyan Han1*"
"1Tianjin Key Laboratory of Chemistry and Analysis of Chinese Materia Medica, College of Chinese"
"Materia Medica, Tianjin University of Traditional Chinese Medicine, Tianjin 300193, China."
"2Department of Experimental Teaching, Tianjin University of Traditional Chinese Medicine,"
"Tianjin 300193, China."
"Authors’ contributions"
"This work was carried out in collaboration between all authors. Authors YZ and XH designed the"
"study, wrote the protocol and wrote the first draft of the manuscript. Author HS managed the literature"
"searches, analyses of the study performed the spectroscopy analysis and author YL managed the"
"experimental process. All authors read and approved the final manuscript."
"Article Information"
