0,1
difference was found to be nonsignificant (p40.05) in both,the NPs. TEM images (Figure 3) of NPs revealed discrete
the cases. The normalized error – Obs)/ (NE ¼ [(cid:2){(Pre,round structures without aggregation. NPs were seen as
Obs}2]1/2) between the observed and predicted values was,matrix structures with particle sizes below 200 nm. DSC
found to be minimum. The NE for PS was found to be,"thermograms of lopinavir, PLGA, physical mixture (lopinavir"
0.04507 and NE for EE was found to be 0.0251.,and PLGA) and lopinavir-loaded NPs are shown in Figure 4.
The NPs were prepared by nanoprecipitation method. The,Pure lopinavir showed an endothermic peak at 94.13 (cid:2)C
optimum formulation had EE 93.03 ± 1.27% and particle size,"showing its crystalline structure, while PLGA showed endo-"
142.1 ± 2.13 nm. The zeta potential of optimized batch was,thermic peak at 51.06 (cid:2)C corresponding to its glass transition
found to be (cid:4)27.2 ± 2.423 mV indicating physical stability of,"temperature (Montgomery, 2004). Physical mixture of drug"
