dec_id	stage	run_id	title	decision	reason	impact	tags	source_file	source_kind	status
MDEC_ROLE_HEADER_VALUE_TYPE_GUARD	stage2-stage3-stage5-layer3_compare	679_layer3_compare_role_header_value_type_guard_source_identity_diagnostic	Generic role-header value-type guard	Generic role headers such as surfactant/polymer/drug concentration may populate concentration values but must not create concrete material names, polymer mass, or drug feed amount fields; source-backed unique material identities from text remain eligible for shared carrythrough.	WFDTQ4VX showed Poloxamer emitted from a generic surfactant concentration header even though the source text identifies Pluronic F68; the same pollution class could affect polymer and drug concentration headers by filling mass/feed slots.	Run679 removes WFDT Poloxamer pollution, preserves UFXX source-backed Poloxamer 407, keeps Layer1 202/202 and 15/15, improves Layer3 present_and_match 2476->2549 and present_but_mismatch 314->186 vs run657, with pH match retained.	role_header_guard|material_identity|surfactant_name|polymer_mass_mg|drug_feed_amount_text|DOE|compare	docs/repair_index/success_pattern_index_v1.tsv	project	active
MDEC_ROLE_TOLERANT_CANONICALIZATION	stage5-layer3_compare	657_layer3_compare_role_tolerant_canonicalization_diagnostic	Role-tolerant emulsifier/stabilizer canonicalization	Layer3 compare now passes the shared value-normalization lexicon into the role-tolerant surfactant/stabilizer union overlay and canonicalizes conservative surface variants such as PVA parentheticals, Tween80/Tween 80, Pluronic F-68/F68, and Solutol HS15.	Active run656 retained 71 role_tolerant_union_overlay mismatches even when the difference was only surface spelling or parenthetical expansion because the merged overlay bypassed the lexicon and had thin name canonicalization.	Run657 keeps Stage5 652 and Layer1 653 unchanged, improves Layer3 present_and_match 2445->2476 and present_but_mismatch 345->314 vs run656; role-tolerant bad cells fall 76->45 while missing, extra, and not_reported counts stay unchanged.	role_tolerant_union_overlay|emulsifier_stabilizer_name|PVA|Tween80|Pluronic F68|Solutol HS15|compare	docs/repair_index/success_pattern_index_v1.tsv	project	active
MDEC_RUN140_STAGE3_SHARED_NUMERIC_RELATION_FIELDS	stage3_stage5	20260423_9c4a03f/140_layer3_compare_stage3_shared_numeric_relation_fields_diagnostic	Layer3 Stage3 shared numeric relation fields	Stage3 resolved_relation_fields already emitted shared numeric/text fields, but Stage5 consumed only a narrow text whitelist. Expanded Stage5 resolved-field consumption with typed guards; removed centrifugation_g/time from core compare surface; run140 diagnostic error_rows 1757->1638 with mismatch/extra unchanged.			stage3;stage5;shared_numeric_relation_fields	data/results/20260423_9c4a03f/140_layer3_compare_stage3_shared_numeric_relation_fields_diagnostic/RUN_CONTEXT.md	run_context	active
MDEC_RUN142_LAYER3_CONCENTRATION_SPLIT_BINDING	stage5_compare	20260423_9c4a03f/142_layer3_compare_gt_concentration_split_binding_diagnostic	Layer3 concentration direct identity and surfactant binding split diagnostic	Advance active diagnostic baseline to run142 after direct row-identity drug concentration recovery and bounded emulsifier/stabilizer name-concentration value/unit split; GT authority TSV was not mutated.	Run142 produced a positive diagnostic delta vs run140: error_rows 1638->1598, present_and_match 1635->1675, missing 779->741, mismatch 85->83, extra/blocked unchanged.	Improves direct concentration and surfactant/stabilizer compare accounting while preserving remaining QLYKLPKT value conflicts and WFDTQ4VX/YGA8VQKU residuals for source/GT adjudication.	layer3;compare;drug_concentration;emulsifier_stabilizer;gt_split;diagnostic_baseline	data/results/20260423_9c4a03f/142_layer3_compare_gt_concentration_split_binding_diagnostic/diagnostic_metadata.json	diagnostic_run	active
MDEC_RUN143_ROW_LOCAL_VOLUME_AUTHORITY	stage5_layer3	20260423_9c4a03f/143_layer3_compare_row_local_volume_authority_diagnostic	Run143 O_volume_mL row-local direct volume authority activated	Run143 activated row-local direct O_volume_mL authority diagnostically.			layer3;stage5;volume;direct_value_authority		manual	active
MDEC_RUN145_SHARED_ENTITY_PREP_PARAM_CARRYTHROUGH	stage5_layer3	20260423_9c4a03f/145_layer3_compare_shared_entity_parameter_carrythrough_diagnostic	Shared entity-bound preparation parameter carrythrough	Stage5 may carry a unique direct preparation-context solvent volume into organic_phase_volume_mL_* when the row already has the bound organic_solvent identity; globally shared drug_name can authorize direct drug mass carrythrough for eligible loaded rows.	Run143 residual O_volume_mL errors were mostly final-table materialization gaps: rows had organic_solvent but no O_volume field bundle.	Run145 vs run143: error_rows 1585->1515; O_volume_mL present_and_match 20->90 and missing 104->34; 70 missing_in_system->present_and_match; mismatch/extra/blocked unchanged.	stage5;layer3;shared_carrythrough;organic_phase_volume;entity_binding	data/results/20260423_9c4a03f/145_layer3_compare_shared_entity_parameter_carrythrough_diagnostic/diagnostic_metadata.json	diagnostic_metadata	active_diagnostic_baseline
MDEC_RUN163_EMULSIFIER_MATERIAL_REGISTRY_GUARDED	stage5_layer3	20260423_9c4a03f/163_layer3_compare_emulsifier_material_registry_guarded2_diagnostic	Guarded emulsifier/material registry diagnostic baseline	Accept run163 as the next diagnostic baseline after bounded row-local surfactant identity, guarded concentration materialization, source-backed material registry recovery, and compare-surface guards.	run154 had positive gains but introduced polymer_grade extras, drug_name false-positive risk, and surfactant concentration mismatches; run163 repairs those regressions.	Layer3 error_rows 1456->1417 vs run150; present_and_match 1817->1835; missing 599->583; present_but_mismatch 83->81; extra 186->165; blocked_alignment unchanged 588; benchmark_valid remains no.	layer3;stage5;emulsifier_stabilizer;material_registry;diagnostic_baseline	data/results/20260423_9c4a03f/163_layer3_compare_emulsifier_material_registry_guarded2_diagnostic/diagnostic_metadata.json	diagnostic_metadata	active
MDEC_RUN166_GENERIC_RATIO_ENDPOINT_DIRECTION		data/results/20260423_9c4a03f/166_layer3_compare_generic_ratio_direction_diagnostic		Generic endpoint-aware ratio direction repair accepted diagnostically: parse ratio endpoint variables/order for all ratio fields (LA:GA, polymer:drug, drug:polymer, polymer:solvent, phase water/oil or organic/aqueous); reverse only inverse-declared directions; avoid bare compact-ratio fallback for conflicting/direction-neutral fields. run166 error_rows 1607->1603 vs run165; benchmark_valid=no.						active
MDEC_RUN172_GENERIC_CONCENTRATION_FACTOR_MATERIALIZATION	stage5_layer3	20260423_9c4a03f/172_layer3_compare_generic_concentration_factor_materialization_diagnostic	Generic concentration factor materialization	Diagnostic run172 added bounded generic source-defined concentration-factor materialization for row-local X/cMaterial assignments; run166->run172 error_rows 1603->1559, missing 836->780; benchmark_valid=no.			layer3;stage5;concentration_factor;direct_value_authority		manual	active
MDEC_RUN173_ROW_IDENTITY_DRUG_NAME_REBINDING	layer3_compare	173_layer3_compare_row_identity_drug_name_rebinding_diagnostic	Generic row-local formulation identity drug-name rebinding	Accept bounded compare-surface extraction of drug_name from row-local formulation_identity_label/table_row_id when direct drug field is blank, rejecting blank/control and ambiguous labels.	L3H2RS2H residual audit showed direct row labels carried XAN/3-MeOXAN while system drug_name surface was blank.	16 L3H2RS2H drug_name cells missing_in_system->present_and_match; error_rows 1559->1543; no mismatch/extra/blocked/non-target changes.	layer3;compare;row_identity;drug_name;L3H2RS2H	docs/methods/layer3_field_gt_protocol_v1.md	method	active
MDEC_S27_ROW_CODE_TABLE_SCOPE_AND_GENERIC_ALIAS_BINDING	stage2-stage3	579_compare_row_code_alias_repair_diagnostic	Row-code table scope recovery and generic material alias binding	S2-7 may infer a formulation-table scope from LLM row-coded formulation candidates or protocol marker targets when table_scopes are missing, using preserved normalized payloads and bounded source_table_files; S3 protocol marker target binding should use generic paper-local material alias tokens rather than hardcoded article material names.	5ZXYABSU showed LLM semantic authorization through NPG/NPR row codes but no table_scopes, causing S2-7 to skip full Table 1 recovery; earlier S3 material binding used narrow Gat/Rh/polysorbate/Labrafil token logic.	Diagnostic lineage 576->580 restores 5ZXYABSU Stage5 count to 9/9 and reduces external_aqueous_phase_volume_mL missing versus run 570; full DEV15 remains non-promotable because L3H2RS2H is +1.	S2-7|row_code_scope|article_local_alias|Stage3|5ZXYABSU|diagnostic	project/4_DECISIONS_LOG.md	project	active
MDEC_S27_SCOPE_ALIAS_ROLE_LOOKUP_AND_SPILLOVER_GUARD	stage2	20260423_9c4a03f/406_qlyk_scope_alias_and_prose_spillover_diagnostic	Stage2 table expansion preserves semantic scope role lookup through authority aliases	Use semantic/original scope id fallback for table_variable_roles after authority payload reopen, and reject prose-spillover optimization sentences as row-level authority assignments.	QLYKLPKT replay exposed that reopened table payload IDs can differ from the LLM semantic table scope, causing role lookup to miss; source-text spillover can also overcount an optimization sentence as a variable row.	Bounded diagnostic replay restored QLYKLPKT final count to 7/7 while preserving LLM-first semantic authority and downstream Stage5 filtering of non-synthesis variants.	S2-7|table_scope_alias|table_variable_roles|QLYKLPKT|prose_spillover|diagnostic	docs/repair_index/success_pattern_index_v1.tsv	repair_index	active
MDEC_S27_SECONDARY_SOURCE_IDENTITY_AND_CHARACTERIZATION_BINDING	stage2-stage5	588_compare_secondary_identity_binding_diagnostic	Secondary source identity recovery and characterization-helper binding	S2-7 may supplement existing LLM-authorized formulation scopes with preserved source-text/table-authority identity scopes that are not already active formulation tables; Stage5 should bind characterization-only LLM helpers back to matching table rows when drug, nanoparticle family, and concentration match.	L3H2RS2H had main Table 1/3 enumeration but skipped Table 2 empty nanospheres, Table 4 empty nanocapsules, and Table 5 sample identities; after recovery, two LLM characterization helpers duplicated table rows.	Full DEV15 diagnostic lineage 583->589 restores Layer1 to 202/202 and 15/15 match; Layer3 run 589 has present_and_match=1824 and missing_in_system=618. ACTIVE_RUN updated as diagnostic baseline; benchmark_valid remains no.	S2-7|secondary_identity_table|Stage5|characterization_binding|L3H2RS2H|diagnostic_baseline	project/4_DECISIONS_LOG.md	project	active
MDEC_S2_1B_SOURCE_DENOISE_PROJECTION	stage2		S2-1b high-confidence source denoise projection	Add S2-1b between S2-1 scope resolution and S2-2 evidence construction; it emits denoised_for_stage2 text while preserving raw/current clean text as audit authority.	DEV15 full-cleantext diagnostics showed obvious publisher/reference/header/footer noise entering candidate/evidence selection; existing cleanup was too late and too weak.	Full original-source extraction should wait for no-live S2-1b->S2-2 acceptance; S2-1b must not perform formulation semantic discovery, table-importance selection, row-universe construction, or GT/source-anchor completion.	stage2|s2-1b|source-denoise|selector-noise|full-source-extraction	project/4_DECISIONS_LOG.md	governance	active
MDEC_S2_4B_EXPLICIT_MODEL_BOUNDARY	stage2		S2-4b explicit model boundary	S2-4b live calls must receive an explicit --model; maintained code has no repository-wide default model identity.	Model switching should affect only raw-response persistence at S2-4b, not S2-4a prompts, S2-5+ parsing/validation/projection, or unrelated live-call utilities.	Changing --model creates a new S2-4b raw-response lineage; benchmark interpretation still requires aligned Stage2 completion lineage and GT authority.	stage2|s2-4b|model-selection|lineage|live-call-boundary	project/4_DECISIONS_LOG.md	governance	active
MDEC_S2_DOE_FACTOR_SCHEMA_COMPLETENESS	stage2-stage3	629_layer3_compare_doe_factor_schema_completeness_diagnostic	S2 DOE factor schema completeness for coded assignments	S2 numbered DOE recovery now emits structured row-local factor assignments with factor_token, factor_name, coded_factor_value, decoded_factor_value, factor_unit, source_table_id, and coding_table_id; Stage3 prefers structured factor labels/tokens before source-text fallback role maps.	WFDTQ4VX had X1/X2/X3 design rows plus a companion factor-level table, but current Stage2 rows lacked complete row assignments and forced compare-side paper-specific coded overrides.	Bounded lineage 623->629 proves WFDT structured assignment production and Stage3 typed fields, but is not promoted because Layer1 regresses to 207/202 from L3H2RS2H +5 retained LLM summary/characterization rows.	DOE|factor_schema|coded_level|WFDTQ4VX|S2|Stage3|not_promoted	project/4_DECISIONS_LOG.md	project	active
MDEC_S5_3_NOT_DATABASE_COMPLETION	stage5		S5-3 is residual source-evidenced gap filling, not database completion	S5-3 must not assume every article reports every target field and must not target blank schema/final-table slots merely because they are empty.	PLGA literature reporting is heterogeneous; absent values may be true non-reporting rather than extraction failure, and dense database-completion would create false positives.	S5-3 scope must be gated by benchmark/GT missing_in_system evidence or audited source evidence; not_reported/unresolved/no-source blanks are not extraction targets; mismatches and blocked alignment need separate workflows.	stage5|s5-3|database-completion|heterogeneous-reporting|scope-gating	project/4_DECISIONS_LOG.md	governance	active
MDEC_STAGE1_HTML_PRIORITY_CURRENT_BINDINGS	stage1	20260511_b069802/01_stage1_source_readiness	Stage1 unified source selection is HTML-first when duplicate current bindings exist	For the unified current+Marker Stage1 handoff, prefer HTML current clean text/structure over duplicate PDF current bindings; use PDF as fallback and attach frozen Marker only for PDF rows where already available.	The user original design was HTML-priority; duplicate key2txt/key2structure bindings had allowed PDF to win for many PDF+HTML rows, so source selection must be based on the selected binding path rather than manifest-level text_source_type defaults.	Updated build_stage1_unified_current_marker_v1.py, maintained_script_surface, and src_script_registry; generated run-scoped unified_full_html_priority artifacts plus refreshed Stage2 admission/preview audit surfaces. No Stage2/LLM/ACTIVE_RUN update.	stage1|html_priority|current_bindings|source_selection|unified_current_marker	data/results/20260511_b069802/01_stage1_source_readiness/RUN_CONTEXT.md	RUN_CONTEXT	active
MDEC_STAGE3_DOE_FACTOR_RELATION_CHAIN	stage2-stage3-stage5	621_layer3_compare_doe_factor_relation_diagnostic	DOE factor assignment relation chain	S2 numbered DOE recovery exposes row-local factor assignments; S3 emits candidate_doe_factor_field rows from structured assignments or legacy DOE change_descriptions; S5 consumes resolved doe_factor_assignment fields into canonical bundles with guards against negative coded concentrations.	UFXX9WXE recovered all DOE rows but phase_ratio_raw stayed missing because w/o phase volume ratio remained a text-like row factor rather than a typed relation field.	Full DEV15 diagnostic lineage 618->621 keeps Layer1 202/202 and 15/15; Layer3 present_and_match improves 2020->2046 and missing_in_system improves 430->404 vs run617, with mismatch/blocked/extra unchanged.	DOE|Stage3|Stage5|factor_schema|phase_ratio_raw|UFXX9WXE	project/4_DECISIONS_LOG.md	project	active
MDEC_STAGE3_MEASUREMENT_TABLE_BINDING	stage3-stage5	593_layer3_compare_measurement_binding_diagnostic	Measurement-table binding for characterization result fields	Stage3 may emit candidate_measurement_binding_field relation rows when a preserved characterization/result table column binds to an already-authorized formulation identity; Stage5 consumes only resolved relation fields and writes size_nm, pdi, and zeta_mV as instance-specific typed bundles.	L3H2RS2H preserved Table 2 and Table 4 characterization surfaces had size/PDI/zeta values for existing formulation rows, but the values were not bound back to final formulation identities.	Full DEV15 diagnostic lineage 590->593 keeps Layer1 at 202/202 and 15/15 match; Layer3 present_and_match improves 1824->1836 and missing_in_system improves 618->606 with mismatch/extra/blocked unchanged.	STAGE3|Stage5|measurement_binding|characterization_results|size_nm|pdi|zeta_mV|L3H2RS2H|diagnostic_baseline	project/4_DECISIONS_LOG.md	project	active
MDEC_STAGE5_PARTIAL_SWEEP_SUMMARY_GUARD	stage5	632_layer3_compare_summary_guard_doe_factor_schema_diagnostic	Stage5 partial sweep summary retention guard	Stage5 partial compact-sweep survival now requires explicit result-bearing evidence before an LLM summary/helper row can bypass complete-table-enumeration and parent-linked non-synthesis descendant filters.	The S2 DOE factor schema diagnostic retained five L3H2RS2H LLM family/characterization summaries with no independent result evidence because the partial-sweep survival guard fired too early.	Lineage 630->632 restores Layer1 to 202/202 and filters F1-F5; active-lineage replay 633->634 is byte-identical to active Stage5 run 619, but no ACTIVE_RUN update because DOE schema lineage Layer3 remains below active 621.	Stage5|membership_guard|partial_sweep|summary_filter|L3H2RS2H|not_promoted	project/4_DECISIONS_LOG.md	project	active
MDEC_STAGE5_PHASE_VOLUME_CARRYTHROUGH	stage5	646_layer3_compare_phase_volume_carrythrough_guarded_diagnostic	Stage5 guarded phase-volume carrythrough	Stage5 may materialize blank organic_phase_volume_mL and external_aqueous_phase_volume_mL bundles from unique clean-source preparation-context phase-volume evidence, including solvent-volume statements without unique solvent identity, PVA/surfactant external phase volumes with concentration text, and carrier-scoped nanosphere/nanocapsule external aqueous volumes.	Active run640 retained phase-volume missing fields even when source text contained preparation statements such as shared solvent volume, 12 mL of 1% PVA, or nanocapsule-specific 20 mL aqueous Pluronic solution.	Guarded full DEV15 lineage 644->646 keeps Layer1 202/202 and 15/15; Layer3 present_and_match improves 2094->2108 and missing_in_system improves 356->342 versus run640 with mismatch, blocked, extra, and not_reported unchanged; ACTIVE_RUN advanced to 644/645/646 as diagnosis-only baseline.	Stage5|protocol_process|phase_volume|O_volume_mL|W2_volume_mL|external_aqueous_phase_volume_mL	project/4_DECISIONS_LOG.md	project	active
MDEC_STAGE5_PROTOCOL_PROCESS_CARRYTHROUGH	stage5	640_layer3_compare_protocol_process_carrythrough_guarded_diagnostic	Stage5 source-backed protocol/process carrythrough	Stage5 may materialize blank global preparation process bundles for stirring_time_h, evaporation_time_h, and pH_raw only from unique clean-source preparation-context evidence, with guards against release/HPLC/buffer contexts and broad evaporation-under-stirring false bindings.	Active run621 retained protocol/process missing fields even when direct preparation statements were present in clean source text because Stage5 global preparation carrythrough covered phase volumes and concentration fields but not process time or preparation pH.	Guarded full DEV15 lineage 638->640 keeps Layer1 202/202 and 15/15; Layer3 present_and_match improves 2046->2094 and missing_in_system improves 404->356 with mismatch, blocked, extra, and not_reported unchanged; ACTIVE_RUN advanced to 638/639/640 as diagnosis-only baseline.	Stage5|protocol_process|source_backed_carrythrough|stirring_time_h|evaporation_time_h|pH_raw	project/4_DECISIONS_LOG.md	project	active
