dec_id	stage	run_id	title	decision	reason	impact	tags	source_file	source_kind	status
MDEC118	Stage5	20260423_9c4a03f/599_stage5_source_group_direct_retention_diagnostic	Stage5 source-group direct-field retention guard accepted	Promote the Stage5 source-group direct-field retention guard as current diagnostic baseline while keeping broad Stage3 table-cell-grid measurement binding diagnostic-gated.	Collapsed final groups can choose a representative row with blank direct fields even when a sibling source row in the same final group carries a unique row-local table-cell direct value; retaining only unique within-group direct values fixes WIVUCMYG PDI without cross-row inference.	DEV15 Layer1 remains 202/202 and 15/15 match; Layer3 present_and_match improves 1836 to 1862 and missing_in_system improves 606 to 580 with no mismatch, extra, or blocked regression vs run 593.	stage5,collapse,direct_field_retention,WIVUCMYG,pdi,diagnostic_baseline	data/results/20260423_9c4a03f/601_layer3_compare_source_group_direct_retention_diagnostic/RUN_CONTEXT.md	run_context	active
MDEC119	Stage3-Stage5	20260423_9c4a03f/609_layer3_compare_grid_measurement_binding_v2_unit_scoped_diagnostic	Dictionary-backed table-cell-grid measurement binding accepted	Enable Stage3 table-cell-grid measurement binding by default using canonical_field_for_header, unit/shape guards, row identity matching, and Stage5 paper-scoped resolved-field lookup.	The earlier broad binding false positives were caused by two generic issues: Stage5 resolved relation lookup was keyed only by formulation_id, allowing F1 collisions across papers, and Stage3 fallback header matching allowed non-percent Drug content (µg/mg) into percent fields. Both are now fixed generically.	DEV15 Layer1 remains 202/202 and 15/15. Layer3 run 609 vs prior active 601 improves present_and_match 1862 to 1865, present_but_mismatch 553 to 550, extra_in_system 110 to 106, with missing_in_system 580 and blocked_alignment 420 unchanged.	stage3,stage5,table_cell_grid,dictionary,measurement_binding,paper_scoped_resolution,diagnostic_baseline	data/results/20260423_9c4a03f/609_layer3_compare_grid_measurement_binding_v2_unit_scoped_diagnostic/RUN_CONTEXT.md	run_context	active
MDEC120	Stage2-Stage3-Stage5	20260423_9c4a03f/614_layer3_compare_metric_tail_measurement_guard_diagnostic	S2 metric-tail measurement guard accepted	Stage2 S2-7 compatibility projection now reads DOE/result metric-tail field=value strings from change_descriptions and may overwrite only suspect PDF glyph/cid table-cell measurement values; Stage3 measurement binding rejects cid pseudo-values and implausible measurement ranges.	WFDTQ4VX DOE rows had correct particle size values in recovered change_descriptions but final table consumed polluted (cid:4)1 table-cell values as size_nm=4. The same cid pseudo-values also entered Stage3 measurement binding, so the fix needed both S2 consumption and S3 value-quality guards.	DEV15 Layer1 remains 202/202 and 15/15. Layer3 run 614 vs prior active 609 improves present_and_match 1865 to 1870 and present_but_mismatch 550 to 545, with missing_in_system 580, blocked_alignment 420, and extra_in_system 106 unchanged.	stage2,stage3,stage5,metric_tail,measurement_binding,cid_guard,WFDTQ4VX,diagnostic_baseline	data/results/20260423_9c4a03f/614_layer3_compare_metric_tail_measurement_guard_diagnostic/RUN_CONTEXT.md	run_context	active
MDEC121	stage5	20260423_9c4a03f/617_layer3_compare_material_mw_grid_concentration_diagnostic	Decision: Add material MW registry v2 and row-local concentration grid consumption	Stage5 materialization now uses dictionary-backed molecular-weight cues plus a Da/kDa range parser to populate source-backed polymer_mw_kDa surfaces, and consumes Stage2 table_cell_grid row-local concentration bindings into polymer/drug concentration value and unit fields.	Current run614 Material missing analysis showed polymer_mw_raw/polymer_mw_kDa and UFXX9WXE concentration-unit cells remained blank despite source text and S2 table-cell-grid evidence already carrying the necessary authority.	Full DEV15 diagnostic replay 615->617 preserved Layer1 202/202 and 15/15; Layer3 present_and_match improved 1870->2020 and missing_in_system reduced 580->430 with no present_and_match regression.	material_inheritance|polymer_mw|table_cell_grid|concentration_unit|stage5|diagnostic_baseline	project/4_DECISIONS_LOG.md	project	active
MDEC139	stage2_stage5	694_layer3_compare_metric_tail_measurement_binding_diagnostic	Accept EE numeric-covariate mainline repair	Accepted the three-step plan: optional S2 typed relation_cues, Stage5 concentration value/unit and DOE coded/physical guards, then Stage5 metric-tail measurement binding for EE/size covariates.	This keeps LLM formulation identification primary while adding typed optional cues and deterministic materialization guards; validation improves Layer3 matches without Layer1 regression.	ACTIVE_RUN advanced to Stage5 692, Layer1 compare 693, and Layer3 compare 694 as diagnosis-only baseline.	stage2;stage5;measurement_binding;doe;value_unit;active_run	data/results/20260423_9c4a03f/694_layer3_compare_metric_tail_measurement_binding_diagnostic/RUN_CONTEXT.md	run_context	active
MDEC140	stage5	720_layer3_compare_entity_role_identity_variable_materializer_diagnostic	Accept Stage5 entity-role identity-variable materializer	Stage5 may materialize row-local identity variable/value pairs into final typed bundles only when the role is explicit or the article-local entity is grounded by existing row/source evidence.	This preserves LLM row membership authority and avoids giving generic rules semantic row-creation power while fixing compare-surface gaps such as etoposide amount -> drug_feed_amount_text.	ACTIVE_RUN advanced to Stage5 718, Layer1 compare 719, and Layer3 compare 720 as diagnosis-only baseline.	stage5;identity_variables;entity_role;dictionary;drug_mass;active_run	data/results/20260423_9c4a03f/720_layer3_compare_entity_role_identity_variable_materializer_diagnostic/61_layer3_compare/RUN_CONTEXT.md	run_context	active
MDEC141	stage5-layer3_compare	726_layer3_compare_s5_2c_numeric_value_unit_structuring_diagnostic	Accept S5-2c deterministic numeric value/unit structuring	Stage5 may split already-materialized physical concentration surfaces into final numeric value and unit bundles while preserving the original combined text surface; Layer3 compare may canonically compare surfactant/stabilizer percent concentration unit surfaces.	This preserves final-output structure for future numeric modeling without row creation, unit conversion, GT backfill, or S5-3 LLM backfill; run726 improves present_and_match 2572->2616, missing_in_system 434->395, and present_but_mismatch 168->163 vs run720.	ACTIVE_RUN advanced to Stage5 724, Layer1 compare 725, and Layer3 compare 726 as diagnosis-only baseline.	stage5;s5-2c;value_unit_splitter;surfactant_concentration;compare_canonicalization;active_run	data/results/20260423_9c4a03f/726_layer3_compare_s5_2c_numeric_value_unit_structuring_diagnostic/61_layer3_compare/RUN_CONTEXT.md	run_context	active
MDEC142	stage5-layer3_compare	729_layer3_compare_generic_doe_factor_physical_materializer_diagnostic	Accept generic DOE factor physical-value materializer	Stage5 may decode row-local DOE coded levels into final physical value/unit bundles only when the source defines a factor/level map; compare must not treat unresolved coded combined surfaces such as -1 mg/mL as physical concentration fallback.	This replaces pH/paper-specific behavior with a bounded generic materialization rule while preserving LLM/S2 row authority and avoiding unit conversion, GT backfill, row creation, or S5-3 LLM numeric backfill; run729 improves present_and_match 2616->2678, missing_in_system 395->385, and present_but_mismatch 163->111 vs run726.	ACTIVE_RUN advanced to Stage5 727, Layer1 compare 728, and Layer3 compare 729 as diagnosis-only baseline.	stage5;doe;factor_level_map;physical_value;value_unit;compare_guard;active_run	data/results/20260423_9c4a03f/729_layer3_compare_generic_doe_factor_physical_materializer_diagnostic/61_layer3_compare/RUN_CONTEXT.md	run_context	active
MDEC143	stage2-stage5	737_layer3_compare_doe_actual_value_type_materializer_diagnostic	Accept generic DOE table continuation and actual-value materialization	S2-7 may recover split table factor definitions by selecting coded-level header rows and merging non-value continuation text; Stage5 may materialize row-local Xn_actual physical assignments into final value/unit bundles without re-decoding.	This addresses table flattening misalignment and checkpoint/actual DOE values generically while preserving active S2-7/Stage3 row authority; run737 improves present_and_match 2678->2711 and missing_in_system 385->352 vs run729 with no mismatch, extra, or not_reported regression.	ACTIVE_RUN advanced to Stage5 735, Layer1 compare 736, and Layer3 compare 737 as diagnosis-only baseline.	stage2;s2-7;table_continuation;stage5;doe;actual_value;value_unit;active_run	data/results/20260423_9c4a03f/737_layer3_compare_doe_actual_value_type_materializer_diagnostic/61_layer3_compare/RUN_CONTEXT.md	run_context	active
MDEC144	stage2-stage5	748_layer3_compare_table_structure_profile_hint_only_boundary_diagnostic	Accept guarded generic table structure profile	S2-2/S2-7 may emit a structural table_structure_profile describing orientation, header regions, data regions, and column-record hints, but profile records must not authorize or instantiate primary formulation rows.	This creates a generic table-geometry sidecar for non-DOE transposed matrices while preserving LLM semantic row authorization; the follow-on hardening makes the profile hint-only in S2-7 so table geometry cannot redefine the row universe.	ACTIVE_RUN advanced to Stage5 746, Layer1 compare 747, and Layer3 compare 748 as diagnosis-only baseline after the hint-only boundary replay; Layer1 remains 202/202 and 15/15, and Layer3 is unchanged vs run743.	stage2;s2-2;s2-7;table_structure_profile;column_record_hints;row_authorization_boundary;active_governance_update	project/4_DECISIONS_LOG.md	project	active
MDEC145	stage2	20260511_b069802/87_stage2_s2_4a_campaign_gate_repair_no_live	Adopt multi-evidence-anchor selector boundary	S2-2 selector must preserve multiple distinct source-body evidence anchors across categories and must not stop after one category slot is filled.	Evidence multiplicity is semantic input for the LLM, not a deterministic category quota; large-campaign audit found hard-gate-passing papers where stronger source-body anchors remained in candidate_blocks but were omitted from S2-4a evidence.	Adds bounded multi-anchor preservation before live LLM calls; no row creation, no formulation membership decision, no GT backfill, no semantic redundancy decision, and no deterministic variant collapse.	stage2;s2-2;selector;evidence_anchor;llm_semantic_authority;large_campaign	project/4_DECISIONS_LOG.md	project	active
MDEC146	stage2	112_stage2_s2_6_deepseek_multi_anchor_context_marker_filter_validation	Filter empty context inheritance marker schema shells before S2-6	S2-5 parser drops context_inheritance_markers that have no source label, table id, targets, inherited fields, held fixed conditions, or evidence cue.	The LLM can emit an all-empty schema placeholder for an absent marker; that object is not semantic discovery and should not block the strict S2-6 marker validator.	Full campaign S2-6 changed from one ZB76MB3J contract error to error_count=0 across 376 documents while preserving real partial and execution-ready context markers.	stage2;s2-5;s2-6;context_inheritance_markers;parser_hygiene;large_campaign	docs/repair_index/success_pattern_index_v1.tsv	repair_index	active
MDEC147	stage2	122_stage5_post_llm_doe_source_text_payload_repair_guarded	Guarded source-text DOE payload fallback inside LLM-authorized S2-7 scope	S2-7 may materialize explicit numbered clean-text table rows only when the LLM has declared a DOE table row enumeration scope; fallback rows must have positive, unique, contiguous labels and may beat lossy Marker payloads when they expose more rows.	UFXX9WXE and 7WLX2UBI had LLM DOE authorization but current campaign normalized payloads were missing or row-label lossy; an initial unguarded replay regressed 6AT9RFVD by treating coded 0 factor levels as formulation rows.	Guarded replay 120->121->122 produced 1042 final rows vs child115 1011 with no negative paper-level final deltas; positive deltas were UFXX9WXE +23 and 7WLX2UBI +8.	stage2;s2-7;doe;source_text_payload;table_authority;large_campaign;diagnostic	docs/repair_index/success_pattern_index_v1.tsv	repair_index	active
MDEC148	stage2	204_209_196_dev15_r1_composition_hint	Decision: do not promote 196 executable-scope path as GPT35 row-count repair	Executable-scope composition/preparation hints may be preserved as adapter signals, but the 196 raw responses lack enough row-universe semantics to recover 139 DEV15 behavior downstream.	Bounded replay changed 5GIF3D8W S2-7 skip reason from missing_llm_variable_roles to insufficient_column_header_rows, while S2-7 and Stage5 counts stayed unchanged.	Future GPT35 repair should preserve the 139-compatible row-materialization semantic shape and add GPT35 fields as auxiliary signals rather than replacing the contract with executable-scope authorization.	DEV15;GPT35;196;139;executable_scope;regression;negative_guardrail	docs/plans/2026-05-19-dev15-gpt35-regression-repair-plan.md	plan	active
MDEC149	stage2	210_217_dev15_139plus_gpt35_aux_signal	Decision: reject broad 139+ GPT35 auxiliary prompt after DEV15 gate failure	The first true 139+ prompt attempt preserved the 139 top-level schema but added a broad GPT35 auxiliary signal block; it must not be promoted because DEV15 five-paper gate regressed.	Stage5 counts changed from 139 baseline 5GIF3D8W 26, 5ZXYABSU 9, L3H2RS2H 21, UFXX9WXE 27, WFDTQ4VX 30 to 139+ R1 counts 6, 9, 14, 26, 30.	Future GPT35 repairs should avoid broad live prompt wording changes; use narrower feature-gated prompt deltas or deterministic downstream repairs from already-present 139-style raw signals.	DEV15;GPT35;139plus;prompt_regression;rejected;5GIF3D8W;L3H2RS2H	docs/plans/2026-05-19-dev15-gpt35-regression-repair-plan.md	plan	active
MDEC150	stage2-stage5	228_stage5_dev15_139plus_narrow_row_universe_final_output	R2A narrow 139+ row-universe prompt rejected	Do not promote the R2A narrow row-universe prompt branch to GPT35 because the five-paper DEV15 gate still regressed versus 139.	Although R2A improved 5GIF3D8W versus broad R1, it left 5GIF3D8W at 20 versus 139/GT 26 and L3H2RS2H at 14 versus 139/GT 21; WFDTQ4VX also dropped at S2-7 from 60 to 33 before Stage5.	Future GPT35 repair should not rely on global prompt wording changes until deterministic replay/materializer options are exhausted; R2A remains diagnostic-only negative evidence.	DEV15|GPT35|139plus|R2A|prompt_regression|diagnostic_only	docs/plans/2026-05-19-dev15-gpt35-regression-repair-plan.md	plan	active
MDEC151	stage2-stage5	220_stage5_ee35_deterministic_from_168_current_replay_final_output	R2B deterministic replay from existing 168 signals selected as positive diagnostic candidate	Prefer R2B as the next GPT35/EE35 repair base over new prompt variants because it improves row recovery without any new live LLM calls.	Replaying 170 through current deterministic S2-7/Stage3/Stage5 increased S2-7 rows 259->285 and Stage5 final rows 212->233 versus 184/186, with 3 improved papers and 0 paper-level final-row regressions in the count audit.	Next repair should analyze remaining gaps from the R2B audit, especially JRMKHP5C, XDIRIJ74, 2RNHC2M5, YZYKTTFE, and KTNLRQZU, before considering more S2-4a prompt edits.	EE35|GPT35|R2B|deterministic_replay|S2-7|Stage5|diagnostic_only	docs/plans/2026-05-19-dev15-gpt35-regression-repair-plan.md	plan	active
MDEC152	stage2-stage5	232_stage5_ee35_r2b_r3_primary_np_id_final_output	R2B-R3 primary NP sample-ID guard accepted as positive diagnostic candidate	Treat nanoparticle sample IDs such as HbNPs-5 as primary formulation identity labels so LLM-authorized partial formulation table rows are not filtered as measurement-only non-primary rows.	JRMKHP5C Table 1 rows were recoverable from authority rows but non_primary_direct_rows_look_measurement_only filtered HbNPs-style labels because formulation_identity_label_looks_primary did not recognize them as primary IDs.	Full EE35 no-live replay improved S2-7 285->296 and Stage5 233->244, with JRMKHP5C 21->32 and 0 paper-level count regressions; diagnostic-only pending identity-level GT alignment.	EE35|GPT35|R2B-R3|S2-7|sample_id|HbNPs|diagnostic_only	docs/plans/2026-05-19-dev15-gpt35-regression-repair-plan.md	plan	active
MDEC153	stage2	236_stage5_ee35_r2b_r4_rowwise_sample_id_label_final_output	R2B-R4 rowwise sample-ID label canonicalization	Preserve native primary first-cell sample IDs during rowwise formulation materialization instead of replacing them with synthetic row_XX labels.	JRMKHP5C Table 3 rows were present but carried synthetic labels such as row_01__hbnps-7, weakening GT identity alignment and downstream row joining.	R2B-R4 kept S2-7 and Stage5 counts unchanged at 296 and 244, reduced JRMKHP5C naive missing GT labels 24->18, and had 0 paper-level count regressions versus R2B-R3.	S2-7|identity_canonicalization|rowwise_table|JRMKHP5C|diagnostic_only	data/results/20260511_b069802/236_stage5_ee35_r2b_r4_rowwise_sample_id_label_final_output/RUN_CONTEXT.md	run_context	active
MDEC154	stage2	248_stage5_ee35_r2b_r5_packed_sample_id_guarded_dedup_final_output	R2B-R5 guarded packed source-row sample-ID recovery	Recover multiple prefixed NP sample IDs from a single authorized source CSV line, but apply cross-table duplicate suppression only to newly augmented packed_prefixed_sample_id_source_row rows.	JRMKHP5C Tables 1 and 2 stored multiple real HbNPs-* identities in one flattened source row; a first dedup attempt regressed ZB76MB3J by filtering legal repeated condition rows, so the guard had to be narrowed.	R2B-R5 guarded increased EE35 S2-7 rows 296->314 and Stage5 rows 244->262 with 0 paper-level count regressions versus R4. JRMKHP5C improved 32->50 and missing GT labels 18->2, but remains diagnostic-only due to +5 over-retention residual.	S2-7|packed_source_rows|sample_id|JRMKHP5C|ZB76MB3J|diagnostic_only	data/results/20260511_b069802/248_stage5_ee35_r2b_r5_packed_sample_id_guarded_dedup_final_output/RUN_CONTEXT.md	run_context	active
MDEC_DEEPSEEK_S2_4B_TRIAL_CONFIG	stage2		DeepSeek S2-4b initial trial configuration	Use frozen S2-4a prompts; start S2-4b DeepSeek trial with deepseek-v4-flash, JSON Output enabled, thinking disabled, no cache settings; reserve pro/thinking-high for bounded comparisons.	Flash likely sufficient for bounded semantic JSON task but needs validation; JSON Output improves structure; provider cache is automatic.	DeepSeek provider/model parameters affect S2-4b raw-response lineage only and do not alter S2-4a or S2-5+.	stage2|s2-4b|deepseek|model-selection|json-output|thinking|cache	docs/api_references/deepseek/deepseek_api_notes_v1.md	docs	active
MDEC_DOE_DECODE_PHYSICAL_GUARD	stage2-stage3-stage5-layer3_compare	656_layer3_compare_doe_decode_physical_guard_diagnostic	DOE decoded pH precedence and physical-value guard	DOE factor assignments now record factor_value_kind and decoding_rule so coded design levels can be decoded while already-physical table values pass through without a second decode; Layer3 compare prefers final typed pH_raw bundles before coded DOE fallback.	Active run654 showed 42 pH_raw mismatches where final Stage5 already held decoded physical pH values but compare returned raw coded DOE levels; user also identified the risk that later DOE result tables may already contain physical values despite a separate coding table.	Run656 keeps Stage5 652 and Layer1 653 unchanged, improves Layer3 present_and_match 2403->2445 and present_but_mismatch 387->345 vs run654, and reduces pH_raw coded_doe_factor_rebinding mismatches 42->0 without changing row counts.	DOE|decode|physical_value_guard|pH_raw|coded_doe_factor_rebinding|Stage2|Stage3|compare	docs/repair_index/success_pattern_index_v1.tsv	project	active
MDEC_GENERIC_SHARED_PARAMETER_BUNDLE_V1	stage3_stage5	148_layer3_compare_generic_shared_parameter_bundle_diagnostic	Generic shared-parameter relation bundle	Stage3 relation resolution may carry arbitrary source-backed shared field names; Stage5 preserves all resolved fields in shared_parameters_json and only projects governed core fields to typed benchmark columns.	Per-field shared carrythrough rules do not scale to unknown paper-specific variables.	Allows unbounded shared parameter transmission without widening the final table per variable; run145 -> run148 compare statuses unchanged.	generic_shared_parameters;stage3;stage5;relation_bundle	docs/methods/layer3_field_gt_protocol_v1.md	method	active
MDEC_GENERIC_VALUE_MATERIALIZATION_CAPABILITY	stage3_stage5		Generic capability restoration for value materialization repairs	Missing direct-value repairs must restore generic capability rather than patching specific papers or isolated fields; concrete papers are validation cases only.	Paper-specific abbreviations, strings, and one-off field rules will not generalize across heterogeneous PLGA articles.	Future S3/S5-2 repairs should be framed around paper-local material alias graphs, entity-value binding, scope-aware shared carrythrough, canonical promotion, and field-type validation with authority guards.	stage3|stage5|generic-repair|material-alias|entity-value-binding|shared-carrythrough|field-validation	project/4_DECISIONS_LOG.md	governance	active
MDEC_L3_SUBTYPE_SURFACTANT_CONC_RUN138	Stage5/Layer3	run138	Subtype-scoped surfactant concentration carrythrough	Rows with exactly one nanosphere/nanocapsule subtype may inherit a unique explicit preparation surfactant/stabilizer concentration from that subtype scope; duplicate unit extras are suppressed when GT value already contains the same unit.	ACTIVE_RUN 135 had residual emulsifier_stabilizer_concentration_value missing cells with safe direct evidence in subtype-specific preparation paragraphs.	Run 138 improved value recall 0.574324->0.682432 and overall error_rows 1773->1757 with no mismatch/extra/blocked increase.	layer3;stage5;emulsifier_stabilizer;concentration;subtype_scope	data/results/20260423_9c4a03f/138_layer3_compare_subtype_surfactant_concentration_unit_suppressed_diagnostic/RUN_CONTEXT.md	diagnostic_run_context	active
MDEC_POLYMER_MASS_SCOPED_PREP_V2	stage5_layer3	135_layer3_compare_polymer_mass_scoped_preparation_v2_diagnostic	polymer_mass scoped preparation carrythrough accepted	Use source-backed direct preparation mass carrythrough for explicit parenthetical material labels and unique nanocarrier subtype scopes; exclude mg/mL concentration mentions from direct mass.	Run 130 low recall reflected safe carrythrough gaps after pollution cleanup, not GT correction need.	polymer_mass_mg recall improved 0.333333 to 0.612903 with accuracy 1.000000 and no match regressions.	polymer_mass_mg;stage5;layer3;direct_value_authority	data/results/20260423_9c4a03f/135_layer3_compare_polymer_mass_scoped_preparation_v2_diagnostic/diagnostic_metadata.json	diagnostic_metadata	active_diagnostic_baseline
MDEC_PROTOCOL_INHERITANCE_MARKER_HANDSHAKE	stage2-stage3-stage5	538_layer3_compare_protocol_inheritance_5zxyabsu_diagnostic	Protocol inheritance marker handshake for same-procedure overrides	Stage2 should expose same-procedure/protocol override markers, S3 should materialize them as targeted candidate_protocol_override_field relation rows, and S5 should consume only resolved relation fields.	"5ZXYABSU showed the source sentence ""same procedure but incorporating 5 mg Gat"" was previously outside the prompt evidence pack or not consumable downstream, leaving drug_mass_mg missing."	Bounded diagnostic replay restored 5ZXYABSU NPG drug_mass_mg for 3/6 aligned GT rows without spreading 5 mg Gat to NPR/NPB rows; no ACTIVE_RUN update until full DEV15 validation.	stage2|stage3|stage5|protocol_inheritance|same_procedure|5ZXYABSU	project/4_DECISIONS_LOG.md	governance	active
MDEC_PROTOCOL_INHERITED_EXACT_FIELD_BINDING	stage2-stage3-stage5	570_layer3_compare_phase_volume_dev15_diagnostic	Protocol inheritance exact inherited fields for phase volumes	Stage2 protocol_inheritance_markers should carry exact unchanged source-protocol values in inherited_fields, while overrides remain target-specific changes; S3 materializes inherited fields separately and S5 consumes them into typed final bundles.	5ZXYABSU showed external aqueous phase volume was semantically inherited from the same procedure but was not represented as a consumable exact field and could remain only in shared_parameters_json.	Bounded 5ZXYABSU run 561 improved external_aqueous_phase_volume_mL from 0/6 to 6/6 present_and_match; full DEV15 run 570 improved Layer3 missing_in_system vs run 548 but Layer1 run 569 remains 192 vs 202 rows, so ACTIVE_RUN is not updated.	stage2|stage3|stage5|protocol_inheritance|phase_volume|5ZXYABSU	project/4_DECISIONS_LOG.md	governance	active
