mem_id	mem_type	ref_id	stage	run_id	title	summary	tags	source_file	source_kind	status
MIDX1686	run	MRUN235	stage2	13_fu_activation_repaired_s2_7_table_call_observability	13_fu_activation_repaired_s2_7_table_call_observability	Consume the `S2-6`-validated `S2-5` semantic-intermediate surface only. | Invoke the maintained compatibility-projection logic without any new LLM call. | Materialize the completed Stage2 artifact required by unchanged downstream `Stage3` consumers.		data/results/20260413_6971522/13_fu_activation_repaired_s2_7_table_call_observability/RUN_CONTEXT.md	run_context	active
MIDX1687	run	MRUN236		20260418_63bf985	20260418_63bf985	`20260418_63bf985`		data/results/20260418_63bf985/RUN_CONTEXT.md	run_context	active
MIDX1688	run	MRUN237	stage2	20260418_9538ec2	20260418_9538ec2	Rebuild DEV15 from the lawful changed boundary at `S2-2` using post-09 repaired Stage2 behavior. | Execute fresh Gemini calls with the maintained `S2-4b` live-call path. | Produce a managed diagnosis baseline candidate only if the full step-wise Stage2 chain and downstream stages complete successfully.		data/results/20260418_9538ec2/RUN_CONTEXT.md	run_context	active
MIDX1689	run	MRUN238		run_20260412_154224_8517d36_s2_4b_frozen_raw_execution_v1	run_20260412_154224_8517d36_s2_4b_frozen_raw_execution_v1	# RUN_CONTEXT	`stage2_s2_4b_pure_execution`	data/results/run_20260412_154224_8517d36_s2_4b_frozen_raw_execution_v1/RUN_CONTEXT.md	run_context	active
MIDX1690	run	MRUN239		20260413_6971522	20260413_6971522	Synthetic bucket parent reconstructed from explicit v2 bucket/child lineage path because bucket root RUN_CONTEXT.md is absent.	v2_bucket_parent	data/results/20260413_6971522/01_baseline_audit/RUN_CONTEXT.md	path_contract	active
MIDX1691	run	MRUN240		20260417_385b6e1	20260417_385b6e1	Synthetic bucket parent reconstructed from explicit v2 bucket/child lineage path because bucket root RUN_CONTEXT.md is absent.	v2_bucket_parent	data/results/20260417_385b6e1/06_dev15_full_baseline_no_marker_live/RUN_CONTEXT.md	path_contract	active
MIDX1692	run	MRUN241		20260418_3579206	20260418_3579206	Synthetic bucket parent reconstructed from explicit v2 bucket/child lineage path because bucket root RUN_CONTEXT.md is absent.	v2_bucket_parent	data/results/20260418_3579206/01_dev15_integrated_post09_repair_baseline_v1/RUN_CONTEXT.md	path_contract	active
MIDX1693	error	MERR1128	stage2	20260418_9538ec2	missing_variable_table	Explicit variable-sweep or optimization tables disappear from the canonical S2-2 evidence handoff despite formulation-bearing local structure.	stage2_variable_sweep_and_table_compaction_v1|S2-2|extract_semantic_stage2_objects_v2.py	project/4_DECISIONS_LOG.md	manual	active
MIDX1694	error	MERR1129	stage2	20260418_9538ec2	table_flattening	Flattened or placeholder-heavy tables leak noisy rows and weak role structure into S2-2 evidence and prompt-facing table payloads.	stage2_variable_sweep_and_table_compaction_v1|S2-2|extract_semantic_stage2_objects_v2.py	project/4_DECISIONS_LOG.md	manual	active
MIDX1695	error	MERR1130	stage2	20260418_9538ec2	false_role_coverage	S2-2 design status can look covered even when role selection misses the execution-critical VARIABLE_TABLE or optimization table needed for downstream capability.	stage2_variable_sweep_and_table_compaction_v1|S2-2|extract_semantic_stage2_objects_v2.py	project/4_DECISIONS_LOG.md	manual	active
MIDX1696	error	MERR1131	stage2	20260418_9538ec2	evidence_budget_overflow	Prompt evidence exceeds the healthy size policy even after selector success, increasing prefill and no-first-token risk at S2-4b.	stage2_variable_sweep_and_table_compaction_v1|S2-3|extract_semantic_stage2_objects_v2.py	project/4_DECISIONS_LOG.md	manual	active
MIDX1697	error	MERR1132	stage2	20260418_9538ec2	near_duplicate_evidence	Near-duplicate narrative or table payloads are emitted into canonical evidence blocks, wasting budget and inflating prompt size.	stage2_variable_sweep_and_table_compaction_v1|S2-2|extract_semantic_stage2_objects_v2.py	project/4_DECISIONS_LOG.md	manual	active
MIDX1698	decision	MDEC092	stage2	20260418_9538ec2	Govern stage2_variable_sweep_and_table_compaction_v1 as the maintained S2-2 class-level repair	Treat variable-sweep rescue, evidence-table compaction, duplicate suppression, and S2-2/S2-3 boundary validation as the governed maintained S2-2 repair set.	stage2_variable_sweep_and_table_compaction_v1|QLYKLPKT|UFXX9WXE|WFDTQ4VX|V99GKZEI	project/4_DECISIONS_LOG.md	manual	active
MIDX2000	decision	MDEC093	stage2	20260421_3579206	Decision: Lock the summary-only coverage-first S2-2 / S2-4a selector contract	Keep all S2-4a table evidence summary-only, reduce selector authority to denoising/coverage/packing only, and return semantic table scoping to the LLM.	project	project/4_DECISIONS_LOG.md	project	active
MIDX2001	decision	MDEC094	stage2		S2-2b confirmed-noise-only table preservation	Irreversible S2-2b table removal is limited to confirmed pure noise; if a table is not confirmed noise, preserve it in the pre-LLM authority surface.	stage2 selector table-preservation confirmed-noise-only	project/4_DECISIONS_LOG.md	governance	active
MIDX2002	decision	MDEC095	stage2		S2-3/S2-4a summary neutrality and structure-first summary contract	The maintained S2-3/S2-4a summary path is neutral across preserved tables; the main residual risk is lossy compression, and header schema plus first-column row identity are the primary summary contract while sample rows are optional aids only.	stage2 summary neutrality summary-contract	project/4_DECISIONS_LOG.md	governance	active
MIDX2003	decision	MDEC096	stage2		Authority reopen metadata is deterministic execution-side metadata	authority_run_dir, authority_payload_root, and related reopen handles are deterministic execution-side metadata and must not be treated as LLM semantic content or depend on the LLM to transmit them.	stage2 authority metadata sidecar replay	project/4_DECISIONS_LOG.md	governance	active
MIDX2004	decision	MDEC097	stage2		Prefer replay from frozen raw responses when the LLM-facing contract is unchanged	When LLM task, prompt content, evidence content, model, and generation settings are unchanged, downstream deterministic contract changes should prefer replay from frozen raw responses over fresh live calls if execution-side metadata can be lawfully reattached.	stage2 replay raw-responses validation	project/4_DECISIONS_LOG.md	governance	active
MIDX2005	error	MERR1133	stage2		5ZXYABSU selector/preservation family	Formulation-bearing Table 1 and Table 2 survive S2-2a but disappear before replay reopen because only Table 14 remains preserved downstream.	failure-family 5ZXYABSU selector preservation table-loss	analysis/paper_repairs/5zxyabsu/5zxyabsu_table_loss_boundary_audit.md	analysis	active
MIDX2006	error	MERR1134	stage2		5GIF3D8W non-DOE single-variable recovery family	A paper has an explicit baseline or optimized formulation table plus later single-variable exploration groups, but those formulation instances are not recoverable by DOE logic or Cartesian expansion.	failure-family 5GIF3D8W non-doe single-variable recovery	analysis/stage2_audits/non_doe_single_variable_recovery_repair_report.md	analysis	active
MIDX2007	decision	MDEC098	stage2		Bounded simple formulation-table deterministic enumeration after semantic authorization	Stage2 may deterministically enumerate base rows for low-ambiguity non-DOE full_formulation tables after LLM table authorization using preserved normalized_table_payload authority; this path does not require LLM row-level output and does not apply to DOE, sweep recovery, or cross-table decode cases.	stage2 simple-table deterministic-enumeration normalized-payload replay-validation	project/4_DECISIONS_LOG.md	governance	active
MIDX2008	error	MERR1135	stage2		simple_formulation_table_family_collapse	A low-ambiguity formulation-bearing table is preserved and semantically authorized, but only a family-level semantic object survives and no deterministic base-row enumeration occurs.	stage2 simple-table family-collapse INMUTV7L deterministic-enumeration	analysis/stage2_audits/simple_table_enumeration_repair_report.md	analysis	active
MIDX2009	decision	MDEC099	stage2	20260422_02e24eb/05_doe_binding_regression_replay	Decision: Restore UFXX9WXE DOE target binding with file-derived table IDs and tolerant numbered-row detection	Bounded replay validation restored UFXX9WXE deterministic DOE enumeration to 26 rows by preferring file-derived __table_N__ identity over conflicting caption-derived numbers and by tolerating spaced numbered labels like 7 . during numbered-row detection.	UFXX9WXE|DOE|target_binding|numbered_rows|S2-2|S2-7	project/4_DECISIONS_LOG.md	manual	active
MIDX2010	error	MERR1136	stage2	20260422_02e24eb/01_stage2	UFXX9WXE DOE authorized_target_unresolved with preserved Table10 asset mis-identified	LLM declares DOE scope for Table 10, but DOE function unit stays authorized=yes called=no and numbered DOE rows are absent from the completed Stage2 candidate surface.	UFXX9WXE|DOE|authorized_target_unresolved|binding|numbered_rows	docs/repair_index/success_pattern_index_v1.tsv	manual	active
MIDX2011	decision	MDEC100	stage2	20260423_9c4a03f	Decision: Recover corrupted split-column variable-sweep tables with source-backed row recovery	Use bounded source-backed row recovery in table_row_expansion_v1 for LLM-authorized variable-sweep tables whose preserved payload stays repair_insufficient/unrepaired_corrupted.	corrupted_split_column_sweep_recovery|L3H2RS2H|stage2_table_row_expansion	project/4_DECISIONS_LOG.md	project	active
MIDX2012	decision	MDEC101	stage5	20260423_9c4a03f	Decision: Collapse later measurement-only rows that reuse DOE labels onto existing DOE formulation cores	For DOE papers, later non-DOE measurement/post-processing rows that reuse a unique deterministic DOE formulation label and only add before/after processing characterization variables must collapse onto the existing DOE formulation core rather than create a new formulation.			manual	active
MIDX2013	decision	MDEC102	stage2	20260423_9c4a03f	Decision: Recover anchorless sequential-optimization single-variable rows from stagewise source-text contracts when row-level raw replay collapsed to family summaries	When a replayed sequential-optimization paper preserves stagewise optimization semantics and selected-condition hints but no longer materializes row-level candidates, Stage2 may recover synthesis-defining single-variable rows directly from explicit stagewise source-text level lists, provided downstream/post-processing variable axes are excluded and an explicit anchor scope is not already available elsewhere in the document.			manual	active
MIDX2014	run	MRUN242	stage2	394_stage2_dev15_structural_s2_4a_prompt_freeze_rebuild_diagnostic	394_stage2_dev15_structural_s2_4a_prompt_freeze_rebuild_diagnostic	S2-4a diagnostic prompt freeze passed structural audit: 15 prompts, 92 table summaries, 0 table_role_hint/semantic_summary/key_columns, 92 summary_contract and column_schema markers; no S2-4b/downstream/benchmark executed.	S2-4a_prompt_freeze_only	data/results/20260423_9c4a03f/394_stage2_dev15_structural_s2_4a_prompt_freeze_rebuild_diagnostic/RUN_CONTEXT.md	run_context	active
MIDX2015	lineage	MLIN119		394_stage2_dev15_structural_s2_4a_prompt_freeze_rebuild_diagnostic	394_stage2_dev15_structural_s2_4a_prompt_freeze_rebuild_diagnostic <- 375_stage2_dev15_v4_flash_tablefix_prellm_diagnostic	Rebuilt S2-4a prompts from run 375 evidence_blocks with generic structural-only table summary contract; no live LLM or downstream stages.	s2_4a_prompt_freeze_from_evidence_blocks	data/results/20260423_9c4a03f/394_stage2_dev15_structural_s2_4a_prompt_freeze_rebuild_diagnostic/RUN_CONTEXT.md	manual	active
MIDX2016	decision	MDEC113	stage2	394_stage2_dev15_structural_s2_4a_prompt_freeze_rebuild_diagnostic	S2-4a structural-only prompt freeze refresh	S2-4a prompt rendering must reject stale cached table-summary text unless it already has summary_contract: structural_prompt_view_only and column_schema and has no table_role_hint, semantic_summary, or key_columns.	s2-4a;structural_prompt;table_summary;pre_llm_semantics;generic_repair	data/results/20260423_9c4a03f/394_stage2_dev15_structural_s2_4a_prompt_freeze_rebuild_diagnostic/analysis/s2_4a_structural_prompt_contract_audit_v1.json	audit	active
MIDX2017	run	MRUN243	stage2	375_stage2_dev15_v4_flash_tablefix_prellm_diagnostic	375_stage2_dev15_v4_flash_tablefix_prellm_diagnostic	Run 375 provides canonical DEV15 evidence_blocks and normalized_table_payloads used to rebuild structural-only S2-4a prompts in run 394.	stage2_prellm_evidence_and_payload_source	data/results/20260423_9c4a03f/375_stage2_dev15_v4_flash_tablefix_prellm_diagnostic/RUN_CONTEXT.md	run_context	active
MIDX2018	error	MERR1137	stage2	20260423_9c4a03f/407-410_diagnostic_replay_review	Paper-specific lexical patch misframed as generic selector capability	Same-procedure variant-preparation selector logic must not depend on paper-local names such as Gat, rhodamine, Labrafil, or polysorbate; generic repairs require structural inheritance/preparation/material-value anchors and separate assay/extraction demotion.	stage2_selector;genericity;paper_specific_lexical_patch;same_procedure_variant;negative_assay_extraction;5ZXYABSU	data/mem/v1/err.tsv	manual_agent_error_record	active
MIDX2019	decision	MDEC114	stage2	434_compare_p9_generic_repair_lineage_diagnostic	p9 generic Stage2 authority reattachment and sweep guard repair	Record p9 as a cross-paper generic Stage2 repair: clean-text authority reattachment for malformed table payloads remains deterministic S2-5 recovery, and S2-7 single-variable expansion must be source-observed endpoint/baseline gated; compare remains diagnostic-only.	p9;stage2;authority_reattachment;single_variable_sweep;diagnostic_baseline	project/4_DECISIONS_LOG.md	governance_decision	active
MIDX2020	run	MRUN249	stage5	434_compare_p9_generic_repair_lineage_diagnostic	434_compare_p9_generic_repair_lineage_diagnostic	Explicit lineage 429 S2-5, 430 S2-6, 431 S2-7, 432 Stage3, 433 Stage5, 434 compare: 13/15 match, target four and 5GIF3D8W match, QLYKLPKT 7/7, diagnostic-only benchmark_valid=no.	diagnostic_compare	data/results/20260423_9c4a03f/434_compare_p9_generic_repair_lineage_diagnostic/RUN_CONTEXT.md	run_context	active
MIDX2021	lineage	MLIN120		429_430_431_432_433_434_p9_generic_repair_lineage	429_430_431_432_433_434_p9_generic_repair_lineage <- 20260423_9c4a03f	Current-working-tree p9 chain: 429 S2-5 parses frozen raw responses, 430 S2-6 validates, 431 S2-7 projects compatibility artifact, 432 Stage3 relation materialization, 433 Stage5 final table, 434 diagnostic count compare.	diagnostic_lineage_child_chain	data/results/20260423_9c4a03f/434_compare_p9_generic_repair_lineage_diagnostic/RUN_CONTEXT.md	manual	active
MIDX2022	run	MRUN250	stage2	20260423_9c4a03f	20260423_9c4a03f	Parent bucket contains active diagnostic count lineages including 428 table-recovery closure and 434 p9 generic repair replay; authority must be resolved through ACTIVE_RUN.json or explicit child paths, not recency.	diagnostic_parent_bucket	data/results/ACTIVE_RUN.json	authority_pointer	active
MIDX2023	run	MRUN251	stage2	429_430_431_432_433_434_p9_generic_repair_lineage	429_430_431_432_433_434_p9_generic_repair_lineage	Chain maps to child runs 429 S2-5, 430 S2-6, 431 S2-7, 432 Stage3, 433 Stage5, 434 diagnostic compare; target four plus 5GIF3D8W match and QLYKLPKT is not over-counted.	diagnostic_lineage_chain	data/results/20260423_9c4a03f/434_compare_p9_generic_repair_lineage_diagnostic/RUN_CONTEXT.md	run_context	active
MIDX373	error	MERR307			error	`5GIF3D8W` | `10.1080/10717540802174662` | GT=32 pred=6 diff=-26 | severe_error	method	docs/methods/dev15_error_diagnostic_summary_2026-03-10.md	method	active
MIDX374	error	MERR308			error	`UFXX9WXE` | `10.1155/2014/156010` | GT=26 pred=5 diff=-21 | severe_error	method	docs/methods/dev15_error_diagnostic_summary_2026-03-10.md	method	active
MIDX375	error	MERR309			error	`WFDTQ4VX` | `10.1080/10717544.2016.1199605` | GT=27 pred=30 diff=3 | moderate_error	method	docs/methods/dev15_error_diagnostic_summary_2026-03-10.md	method	active
MIDX376	error	MERR310			drop	2. Reviewer updates dropdown fields and optional notes.	method	docs/methods/dev15_formulation_skeleton_annotation_tool.md	method	active
MIDX377	error	MERR311			drop	Lookup sheet: `dropdown_options` (hidden)	method	docs/methods/dev15_formulation_skeleton_annotation_tool.md	method	active
MIDX378	error	MERR312			drop	Reviewer mostly uses dropdowns for:	method	docs/methods/dev15_formulation_skeleton_annotation_tool.md	method	active
MIDX379	error	MERR313			missing_drop	missing-dropdown highlighting	method	docs/methods/dev15_formulation_skeleton_annotation_tool.md	method	active
MIDX380	error	MERR314	stage5		collapse	Stage5 can only retain, collapse, decode, or export candidates that already exist.	method	docs/methods/doe_logic_audit_ufxx9wxe_2026-03-13.md	method	active
MIDX381	error	MERR315			collapse	downstream generalized DOE collapse	method	docs/methods/doe_logic_audit_ufxx9wxe_2026-03-13.md	method	active
MIDX382	error	MERR316	stage5		collapse_failure	This is not primarily a Stage5 collapse failure.	method	docs/methods/doe_logic_audit_ufxx9wxe_2026-03-13.md	method	active
MIDX383	error	MERR317			drop_dropped	overlapping numeric `llm_extracted` rows are dropped in favor of explicit	method	docs/methods/doe_logic_audit_ufxx9wxe_2026-03-13.md	method	active
MIDX384	error	MERR318			failure_fail	Audit the repository for existing DOE-related logic, record the confirmed `UFXX9WXE` failure mode in engineering-useful terms, and determine whether a new implementation is actually needed.	method	docs/methods/doe_logic_audit_ufxx9wxe_2026-03-13.md	method	active
MIDX385	error	MERR319	stage2		failure_fail	The failure specifically concerns numbered DOE/design-table rows that were not enumerated as Stage2 formulation candidates.	method	docs/methods/doe_logic_audit_ufxx9wxe_2026-03-13.md	method	active
MIDX386	error	MERR320	stage2		failure_fail	This is a confirmed Stage2 under-enumeration failure.	method	docs/methods/doe_logic_audit_ufxx9wxe_2026-03-13.md	method	active
MIDX387	error	MERR321	stage3		failure_fail	This is not primarily a Stage3 relation failure.	method	docs/methods/doe_logic_audit_ufxx9wxe_2026-03-13.md	method	active
MIDX388	error	MERR322	stage1		missing	Active Stage1 can help surface tables, but it does not solve the missing-row enumeration problem.	method	docs/methods/doe_logic_audit_ufxx9wxe_2026-03-13.md	method	active
MIDX389	error	MERR323	stage4		missing	It does not create missing Stage2 formulation candidates.	method	docs/methods/doe_logic_audit_ufxx9wxe_2026-03-13.md	method	active
MIDX390	error	MERR324			missing	Missing numbered DOE rows must be enumerated before relation inference and before final closure.	method	docs/methods/doe_logic_audit_ufxx9wxe_2026-03-13.md	method	active
MIDX391	error	MERR325	stage3		missing	No mechanism to invent or recover missing formulation rows when Stage2 did not emit them.	method	docs/methods/doe_logic_audit_ufxx9wxe_2026-03-13.md	method	active
MIDX392	error	MERR326	stage3		missing	Stage3 cannot create missing candidates.	method	docs/methods/doe_logic_audit_ufxx9wxe_2026-03-13.md	method	active
MIDX393	error	MERR327	stage3		missing	Stage3 is not the right place to solve missing DOE row enumeration.	method	docs/methods/doe_logic_audit_ufxx9wxe_2026-03-13.md	method	active
MIDX394	error	MERR328	stage5		missing	Stage5 DOE derivation and schema tools are downstream and branch-active; they operate after candidate extraction and do not repair missing Stage2 rows in the mainline path.	method	docs/methods/doe_logic_audit_ufxx9wxe_2026-03-13.md	method	active
MIDX395	error	MERR329	stage3		missing	The missing functionality belongs before Stage3 and before Stage5 closure.	method	docs/methods/doe_logic_audit_ufxx9wxe_2026-03-13.md	method	active
MIDX396	error	MERR330	stage2		missing	merge missing numbered rows additively into the Stage2 candidate stream	method	docs/methods/doe_logic_audit_ufxx9wxe_2026-03-13.md	method	active
MIDX397	error	MERR331			regression	expose a regression threshold via `--expected-min-recovered`	method	docs/methods/doe_logic_audit_ufxx9wxe_2026-03-13.md	method	active
MIDX398	error	MERR332			regression	it is not baseline-ready because broader regressions remain in that lineage.	method	docs/methods/doe_logic_audit_ufxx9wxe_2026-03-13.md	method	active
MIDX399	error	MERR333			regression	strong-structure cases while keeping the scope narrow enough to audit regressions.	method	docs/methods/doe_logic_audit_ufxx9wxe_2026-03-13.md	method	active
MIDX400	error	MERR334			fail	If evidence span contains a boilerplate line, the field is failed (`fail_boilerplate=1`).	method	docs/methods/evidence_alignment_hardening_plan.md	method	active
MIDX401	error	MERR335			failure_fail	Failure is recorded as `fail_numeric_token=1`.	method	docs/methods/evidence_alignment_hardening_plan.md	method	active
MIDX402	error	MERR336			failure_fail	Failure recorded as `fail_deprioritized_section=1`.	method	docs/methods/evidence_alignment_hardening_plan.md	method	active
MIDX403	error	MERR337			mismatch	`10.1016/j.ejpb.2004.09.002` | key `L3H2RS2H` | segmentation/alignment difficulty (top EE mismatch and contamination risk)	method seen:7	docs/methods/formulation_instance_pilot3_eval_2026-03-10.md	method	active
MIDX407	error	MERR341			collapse	For this paper, that meant separate nanosphere and nanocapsule concentration rows were collapsed into a few abstract variants, especially around the `Table 1/2` and `Table 3/4/5` sweeps.	method	docs/methods/l3h2rs2h_formulation_instance_regression_audit_2026-03-10.md	method	active
MIDX408	error	MERR342			collapse	Raw model output already contained only 8 family-level records (`NS-XAN-50`, `NC-XAN`, etc.), so the collapse happened in the LLM extraction step before flattening.	method	docs/methods/l3h2rs2h_formulation_instance_regression_audit_2026-03-10.md	method	active
MIDX409	error	MERR343			collapse	The successful rerun no longer collapses the sweep into 8 family summaries, but it still skips that one baseline row.	method	docs/methods/l3h2rs2h_formulation_instance_regression_audit_2026-03-10.md	method	active
MIDX410	error	MERR344			collapse_regression	Truncation was not the main cause of the original 8-count regression either: the full-window baseline still returned 8. The earlier 20k run did additionally hide `Table 3/4/5`, but the family-level collapse was already present without truncation.	method	docs/methods/l3h2rs2h_formulation_instance_regression_audit_2026-03-10.md	method	active
MIDX411	error	MERR345			missing	Missing row: the empty nanocapsule baseline corresponding to the `Table 3/4` `0.5 mL Myritol 318` block.	method	docs/methods/l3h2rs2h_formulation_instance_regression_audit_2026-03-10.md	method	active
MIDX414	error	MERR348			collapse	These statuses must not be collapsed into an empty string.	method	docs/methods/layer3_field_gt_protocol_v1.md	method	active
MIDX416	error	MERR350			missing	`evidence_status_detail=missing_evidence_anchor`	method	docs/methods/layer3_field_gt_protocol_v1.md	method	active
MIDX417	error	MERR351			missing	`evidence_status_detail` must reflect `missing_evidence_anchor` or an	method	docs/methods/layer3_field_gt_protocol_v1.md	method	active
MIDX418	error	MERR352	layer3		missing	`missing_evidence_anchor`	method	docs/methods/layer3_field_gt_protocol_v1.md	method	active
MIDX419	error	MERR353			missing	mass ratio context is missing	method	docs/methods/layer3_field_gt_protocol_v1.md	method	active
MIDX420	error	MERR354	layer3		missing	when direct support is missing	method	docs/methods/layer3_field_gt_protocol_v1.md	method	active
MIDX421	error	MERR355			regression	The contract is regression-protected by:	method	docs/methods/layer3_field_gt_protocol_v1.md	method	active
MIDX422	error	MERR356			mismatch	Numeric evidence anchoring, token checks, and evidence mismatch gating.	method	docs/methods/llm_deterministic_responsibility_contract_2026-03-06.md	method	active
MIDX423	error	MERR357			missing	5. Core signature assignment logic that infers missing semantic structure.	method	docs/methods/llm_deterministic_responsibility_contract_2026-03-06.md	method	active
MIDX424	error	MERR358			missing	core signature assignment logic compensating for missing upstream structure.	method	docs/methods/llm_deterministic_responsibility_contract_2026-03-06.md	method	active
MIDX425	error	MERR359			missing	explicit missingness in structured output.	method	docs/methods/llm_deterministic_responsibility_contract_2026-03-06.md	method	active
MIDX426	error	MERR360			regression	Family key: `20260312 / 455ac37 / targeted5_stage2_regression_v1`	method	docs/methods/results_lineage_normalization_pass.md	method	active
MIDX427	error	MERR361		run_20260312_1030_455ac37_targeted5_stage2_regression_v1	regression	Parent chosen: `run_20260312_1030_455ac37_targeted5_stage2_regression_v1`	method	docs/methods/results_lineage_normalization_pass.md	method	active
MIDX432	error	MERR366			drop	review workbook drops	method	docs/methods/results_top_level_governance_v1.md	method	active
MIDX433	error	MERR367			collapse	Never collapse table rows into family summaries before enumeration.	method	docs/methods/row_level_enumeration_table_heavy_rule_2026-03-10.md	method	active
MIDX434	error	MERR368			regression	This rule was validated on `10.1016/j.ejpb.2004.09.002` (`L3H2RS2H`), where the regression was caused by premature abstraction of table rows into family-level summaries. The prompt-side row-enumeration constraint improved formulation-instance recall without changing the ontology or adding DOE decoding.	method	docs/methods/row_level_enumeration_table_heavy_rule_2026-03-10.md	method	active
