0,1
pubs.acs.org/journal/abseba ACS Biomaterials Science & Engineering,Article
Figure 5. Effect of nanoparticle concentration on HCEC function as measured using MTT assay over 24 h of,incubation for (A) bare PLGA NPs
and (B) surface-modified nanoparticles.,
"Figure 6. Quantitative uptake of nanoparticles by HCECs. Uptake at different exposure time, showing saturation of the cells by nanoparticle within",
"20 min (A), uptake values for various nanoparticles at 20 min (B), and uptake values for different nanoparticles as a function of nanoparticle zeta",
potential (C).,
434,https://doi.org/10.1021/acsbiomaterials.3c01144
,"ACS Biomater. Sci. Eng. 2024, 10, 429−441"
