file	change_summary	anchor_or_guard	before_status	after_status	risk_note
src/stage2_sampling_labels/extract_semantic_stage2_objects_v2.py	Added auditable high-confidence NOT_TABLE hard-drop rules for reference-like, figure-caption-like, OCR-cid-garbage, and strongly prose-dominated pseudo-table surfaces; preserved ambiguous tables.	shared	confirmed-noise-only preservation still allowed pseudo-table prompt bloat	narrow NOT_TABLE filter active with audit fields in candidate/payload/debug surfaces	Conservative by design; partial shrinkage only where high-confidence NOT_TABLE evidence exists.
data/results/20260421_9c4a03f/07_s2_4a_not_table_validation_rerun2 + 08_s2_4a_not_table_prompt_rerun2	Bounded S2-2 -> S2-4a validation outcome	WFDTQ4VX	prompt_size=20261, table_count=16	prompt_size=19288, table_count=15, key_tables_preserved=yes	Prompt shrank slightly; real DOE tables remained, but several pseudo-table-like surfaces still remain. Removed: WFDTQ4VX__table_16__pdf_table.csv, WFDTQ4VX__table_17__pdf_table.csv. Added: WFDTQ4VX__table_08__pdf_table.csv.
data/results/20260421_9c4a03f/07_s2_4a_not_table_validation_rerun2 + 08_s2_4a_not_table_prompt_rerun2	Bounded S2-2 -> S2-4a validation outcome	5ZXYABSU	prompt_size=16790, table_count=14	prompt_size=14909, table_count=12, key_tables_preserved=yes	Prompt shrank materially; key formulation tables remained and obvious pseudo-tables were removed. Removed: 5ZXYABSU__table_09__pdf_table.csv, 5ZXYABSU__table_10__pdf_table.csv.
data/results/20260421_9c4a03f/07_s2_4a_not_table_validation_rerun2 + 08_s2_4a_not_table_prompt_rerun2	Bounded S2-2 -> S2-4a validation outcome	UFXX9WXE	prompt_size=19458, table_count=17	prompt_size=19458, table_count=17, key_tables_preserved=yes	Key Box-Behnken tables remained, but this narrow NOT_TABLE filter did not shrink the prompt pack.
data/results/20260421_9c4a03f/07_s2_4a_not_table_validation_rerun2 + 08_s2_4a_not_table_prompt_rerun2	Bounded S2-2 -> S2-4a validation outcome	INMUTV7L	prompt_size=13036, table_count=11	prompt_size=13036, table_count=11, key_tables_preserved=yes	Guard stayed stable with no prompt change.
data/results/20260421_9c4a03f/07_s2_4a_not_table_validation_rerun2 + 08_s2_4a_not_table_prompt_rerun2	Bounded S2-2 -> S2-4a validation outcome	WIVUCMYG	prompt_size=9805, table_count=6	prompt_size=9805, table_count=6, key_tables_preserved=yes	DOE guard stayed unchanged and compact.
data/results/20260421_9c4a03f/07_s2_4a_not_table_validation_rerun2 + 08_s2_4a_not_table_prompt_rerun2	Bounded S2-2 -> S2-4a validation outcome	5GIF3D8W	prompt_size=15291, table_count=7	prompt_size=15291, table_count=7, key_tables_preserved=yes	Guard stayed stable with no prompt change.
