0,1
,"Int J Ophthalmol, Vol. 15, No. 11, Nov.18, 2022 www.ijo.cn"
,Tel: 8629-82245172 8629-82210956 Email: ijopress@163.com
"26 Adijanto J, Naash MI. Nanoparticle-based technologies for retinal gene","28 He GH, Zhang W, Ma YX, Yang J, Chen L, Song J, Chen S."
therapy. Eur J Pharm Biopharm 2015;95:353-367.,Mesenchymal stem cells-derived exosomes ameliorate blue light
"27 Tsiapalis D, O’Driscoll L. Mesenchymal stem cell derived extracellular",stimulation in retinal pigment epithelium cells and retinal laser
vesicles for tissue engineering and regenerative medicine applications.,injury by VEGF-dependent mechanism. Int J Ophthalmol 2018;11(4):
Cells 2020;9(4):991.,559-566.
,1751
