scope_id	allowed_scripts	forbidden_scripts	expected_unchanged_artifact_families	allowed_changed_artifact_families	warn_on_changed_artifact_families	notes
full_pipeline_baseline_run	"[""src/stage2_sampling_labels/run_stage2_composite_v1.py"",""src/stage3_relation/build_formulation_relation_artifacts_v1.py"",""src/stage5_benchmark/build_minimal_final_output_v1.py"",""src/stage5_benchmark/enforce_identity_freeze_v1.py"",""src/stage5_benchmark/compare_final_table_to_gt_v1.py""]"	"[]"	"[]"	"[""stage2_candidate_blocks"",""stage2_evidence_blocks"",""stage2_prompt_artifacts"",""stage2_raw_responses"",""stage2_semantic_objects"",""stage2_compat_projection"",""stage3_relation_artifacts"",""stage5_final_outputs"",""stage5_compare_outputs"",""feature_activation""]"	"[]"	Full-pipeline baseline registration scope. Use when freezing or comparing a complete maintained Stage2 through Stage5 baseline lineage; all maintained stage families may lawfully differ because the baseline object itself is the comparison target.
s2_2b_selector_only	"[""src/stage2_sampling_labels/run_stage2_composite_v1.py"",""src/stage2_sampling_labels/extract_semantic_stage2_objects_v2.py""]"	"[""src/stage2_sampling_labels/run_stage2_s2_4a_prompt_construction_v1.py"",""src/stage2_sampling_labels/run_stage2_s2_4b_live_llm_call_v1.py"",""src/stage2_sampling_labels/run_stage2_s2_5_semantic_parsing_v1.py"",""src/stage2_sampling_labels/run_stage2_s2_7_compatibility_projection_v1.py"",""src/stage3_relation/build_formulation_relation_artifacts_v1.py"",""src/stage5_benchmark/build_minimal_final_output_v1.py"",""src/stage5_benchmark/compare_final_table_to_gt_v1.py""]"	"[""stage2_candidate_blocks"",""stage2_prompt_artifacts"",""stage2_raw_responses"",""stage2_semantic_objects"",""stage2_compat_projection"",""stage3_relation_artifacts"",""stage5_final_outputs"",""stage5_compare_outputs""]"	"[""stage2_evidence_blocks"",""feature_activation""]"	"[""feature_activation""]"	Selector-only scope freeze. Evidence-block outputs may change, but candidate segmentation, prompt, raw-response, semantic-object, compatibility-projection, Stage3, and Stage5 surfaces should remain frozen.
s2_4a_prompt_only	"[""src/stage2_sampling_labels/run_stage2_s2_4a_prompt_construction_v1.py"",""src/stage2_sampling_labels/run_stage2_composite_v1.py""]"	"[""src/stage2_sampling_labels/run_stage2_s2_4b_live_llm_call_v1.py"",""src/stage2_sampling_labels/run_stage2_s2_5_semantic_parsing_v1.py"",""src/stage2_sampling_labels/run_stage2_s2_7_compatibility_projection_v1.py"",""src/stage3_relation/build_formulation_relation_artifacts_v1.py"",""src/stage5_benchmark/build_minimal_final_output_v1.py"",""src/stage5_benchmark/compare_final_table_to_gt_v1.py""]"	"[""stage2_candidate_blocks"",""stage2_evidence_blocks"",""stage2_raw_responses"",""stage2_semantic_objects"",""stage2_compat_projection"",""stage3_relation_artifacts"",""stage5_final_outputs"",""stage5_compare_outputs""]"	"[""stage2_prompt_artifacts"",""feature_activation""]"	"[""feature_activation""]"	Prompt-only scope freeze. Prompt artifacts may change, but evidence selection should normally remain frozen and downstream families must not drift silently.
s2_5_semantic_parsing_only	"[""src/stage2_sampling_labels/run_stage2_s2_5_semantic_parsing_v1.py"",""src/stage2_sampling_labels/run_stage2_composite_v1.py""]"	"[""src/stage2_sampling_labels/run_stage2_s2_4b_live_llm_call_v1.py"",""src/stage2_sampling_labels/run_stage2_s2_7_compatibility_projection_v1.py"",""src/stage3_relation/build_formulation_relation_artifacts_v1.py"",""src/stage5_benchmark/build_minimal_final_output_v1.py"",""src/stage5_benchmark/compare_final_table_to_gt_v1.py""]"	"[""stage2_candidate_blocks"",""stage2_evidence_blocks"",""stage2_prompt_artifacts"",""stage2_raw_responses"",""stage2_compat_projection"",""stage3_relation_artifacts"",""stage5_final_outputs"",""stage5_compare_outputs""]"	"[""stage2_semantic_objects"",""feature_activation""]"	"[""feature_activation""]"	Semantic-parsing-only scope freeze. Parsed semantic objects may change, but raw responses should normally remain frozen and no compatibility, Stage3, or Stage5 drift should be accepted silently.
stage3_relation_only	"[""src/stage3_relation/build_formulation_relation_artifacts_v1.py""]"	"[""src/stage2_sampling_labels/run_stage2_s2_4a_prompt_construction_v1.py"",""src/stage2_sampling_labels/run_stage2_s2_4b_live_llm_call_v1.py"",""src/stage2_sampling_labels/run_stage2_s2_5_semantic_parsing_v1.py"",""src/stage2_sampling_labels/run_stage2_s2_7_compatibility_projection_v1.py""]"	"[""stage2_candidate_blocks"",""stage2_evidence_blocks"",""stage2_prompt_artifacts"",""stage2_raw_responses"",""stage2_semantic_objects"",""stage2_compat_projection""]"	"[""stage3_relation_artifacts"",""stage5_final_outputs"",""stage5_compare_outputs"",""feature_activation""]"	"[""feature_activation""]"	Stage3-only scope freeze. Completed Stage2 inputs should remain frozen. Stage5 drift is allowed only as a downstream consequence of changed Stage3 relation artifacts, and feature-activation drift still requires review.
stage5_filtering_only	"[""src/stage5_benchmark/build_minimal_final_output_v1.py"",""src/stage5_benchmark/enforce_identity_freeze_v1.py"",""src/stage5_benchmark/compare_final_table_to_gt_v1.py""]"	"[""src/stage2_sampling_labels/run_stage2_s2_4a_prompt_construction_v1.py"",""src/stage2_sampling_labels/run_stage2_s2_4b_live_llm_call_v1.py"",""src/stage2_sampling_labels/run_stage2_s2_5_semantic_parsing_v1.py"",""src/stage2_sampling_labels/run_stage2_s2_7_compatibility_projection_v1.py"",""src/stage3_relation/build_formulation_relation_artifacts_v1.py""]"	"[""stage2_candidate_blocks"",""stage2_evidence_blocks"",""stage2_prompt_artifacts"",""stage2_raw_responses"",""stage2_semantic_objects"",""stage2_compat_projection"",""stage3_relation_artifacts""]"	"[""stage5_final_outputs"",""stage5_compare_outputs"",""feature_activation""]"	"[""feature_activation""]"	Stage5-filtering-only scope freeze. Stage2 and Stage3 surfaces should remain frozen. Only benchmark-final outputs, compare surfaces, and warning-tier feature activation are allowed to differ.
